index,name,duration_ms,popularity,num_markets,album,disc_number,is_explicit,track_number,release_date,artist,danceability,energy,key,loudness,mode,speechiness,acousticness,instrumentalness,liveness,valence,tempo,time_signature,lyrics,region
8,40 Water,217866,20,78,The Ball Street Journal (Explicit Version),1,TRUE,10,11/24/2008,E-40,0.854,0.546,1,-6.303,1,0.198,0.0715,0,0.0587,0.367,110.967,4,"Water, water, water, water
Water, water, water, water

I wish I was 40, I wish I was water
I wish I was 40, I wish I was water
I wish I was 40, I wish I was water
I wish I was 40, I wish I was water

40 different ways, 40 days, 40 nights
40 on the side, 40 thieves in the night
Been in the game for 20 years and I'm 40 years though?
6 A cougar, 40 years cold

40 ounce of brew, 40 this, 40 that
40 at the crap table shooting 40 stacks
40 thousands fans, 40 niggas on stage
I heard 40's 40 but 40 don't act his age

40 stay relevant, 40 ain't never played
40 ain't a punk, 40 will pull the gage
40 years change with the hawk sitting on her
40 ain't left the hood, 40 around the corner

40 like to drink, 40 be getting drunk
My brodies, a hip-o-holic, he smoke 40 blunts
40 kicks a blow, 40 pounds of grapes
Give me 40 feet and a ounce of space

Water, water, water, water
Water, water, water, water

I wish I was 40, I wish I was water
I wish I was 40, I wish I was water
I wish I was 40, I wish I was water
I wish I was 40, I wish I was water

This that new water, this shit go
Water my grass and my green gone grow
It takes water to live, it's water under the bridge
Water with the baking soda whipping up kids

It's a drought without water, the soil can't crack
Water in the duals makes loud glass packs
My family know me by Earl but water my handle
All the gooing in the club, drinking water like a camel

Put some paint where it ain't, water based paint
If you don't drink no water, my ninja, you might faint
Water be everywhere but water from the V
Water be limping like he got water in his knee

Water pour, water simmer, water heat
Keep my head above water, still water run deep
Water in my bong, water do the fruit
Water trust no one, ain't no leaks in my pool

Water, water, water, water
Water, water, water, water

I wish I was 40, I wish I was water
I wish I was 40, I wish I was water
I wish I was 40, I wish I was water
I wish I was 40, I wish I was water

I don't be seeing anything, I be making sense
Y'all be looking for a walk, I be swing for the fence
Under pressure, never tense, rhyming is a synch
Change the rap game when they let me up off the bench

Back with that 91 super Atlantic flow
I've done seen your favorite rappers come and go
I done seen a lot of blow, a lot of snow
I done seen my homie grandma get beat by the po-po

In the hill side of Vallejo, County of Selano
Get off a magazine and meet me over there by McDonald's
That's why I used to get my yola stacks off
Back then I was small time, all I had was rocks

Manage with it, a fixture on the streets
He a vegan, he don't like beef
They got their E's mixed up
I just look like this but I'd fuck a nigga up

Water, water, water, water
Water, water, water, water

I wish I was 40, I wish I was water
I wish I was 40, I wish I was water
I wish I was 40, I wish I was water
I wish I was 40, I wish I was water

I wish I was 40, I wish I was
I wish I was 40, I wish I was
I wish I was 40, I wish I was
I wish I was 40, I wish I was",westcoast
9,Poor Man's Hydraulics,264653,23,78,The Ball Street Journal (Explicit Version),1,TRUE,11,11/24/2008,E-40,0.832,0.377,1,-8.678,1,0.568,0.0211,0,0.108,0.516,101.904,4,"[Hook]
I punch the gas, I hit the brakes (x4)

The poor man's hydraulics (x4)

[Verse 1]
Yokin' it up, tearin' it up
Wakin' 'em up, showin' my butt
Serving some weight, having my cake
Acting a ape, smoking my grapes

Lifted and splifted, whiskeyed and twisted
Me and my niggas get it and fit it
Makin' 'em mad, makin' 'em sad
Love to boast, love to brag

Slangin' them raps, selling these tracks
Up in ya broad, up in ya batch
My trunk is throbbing, my system knock
My amps is making my woofers pop

Fully refurbished, fully restored
70' Cutlass stick in the floor
Turfin' and crumpin', snapping and stepping
Trappin' and slumming, bangin' and reppin'

[Hook]
I punch the gas, I hit the brakes (x4)

The poor man's hydraulics (x4)

[Verse 2]
Get it to the right, get it to the left
Make your tires bounce like a insufficient check
Make your car dance like a dance contest
Do some acrobatics till it lead to your arrest

Exciting, joyriding
High siding, big timing
Brand new shocks, rebuilt motor
What color paint is that? - Chocolate Mocha

Chrome lips, chrome tips
Chrome everywhere, chrome on my hip
Reputable, intellectual
I'm trying to fit you in my schedule

Sticking and moving, reducing my prices
Adjusting my rates, bringin' new clients
Checking my traps, running my route
Collecting my snaps, peeling on out

[Hook]
I punch the gas, I hit the brakes (x4)

The poor man's hydraulics (x4)

[Bridge]
Get it off the ground (x8)

[Verse 3]
Look at me squat, look at me mash
Look at me yoke, look at me smash
Oh, me, I ain't playin'
Oh, me, I'm my biggest fan

Me no cupcake, me no mark
Me no sucka, me got heart
289, 454
Fresh outta impound, fresh outta tow

He so foolish, I concur
Roger that, aye, aye sir
Unusual slump, dinormous slap
He off a blunt, he on that yatch

Show casing, car racing
Ice skating, lane changing
Heads or tails, flipping a coin
Bill of sales everyday morn

[Hook]
I punch the gas, I hit the brakes (x4)

The poor man's hydraulics (x4)

I punch the gas, I hit the brakes (x4)

The poor man's hydraulics (x4)

[Bridge]
Get it off the ground (x8)",westcoast
10,The Recipe (feat. Bun B & Gucci Mane),260186,20,78,The Ball Street Journal (Explicit Version),1,TRUE,12,11/24/2008,E-40,0.716,0.592,8,-8.209,1,0.32,0.00852,0,0.188,0.692,146.026,4,"[intro]
Hey, this is cooking with Brook
On the cooking channel
Today we're gonna be making c-crack

[Hook: Bun b & Brook from the Cooking Channel]
First take 36 ounces of coke
Mixing it with water in a pot on the stove
Next step to make them boulders add, baking soda
If the flame is low then turn it up and stir it up
Finally, just wait till it gets hard
Then bag it up, you got a key
Homie, that's the recipe, that's the recipe
T-t-that's the recipe
First take 36 ounces of coke
Mixing it with water in a pot on the stove
Next step to make them boulders add, baking soda
If the flame is low then turn it up and stir it up
Finally, just wait till it gets hard
Then bag it up, you got a key
Homie, that's the recipe, that's the recipe
That's the recipe

[Verse 1: E-40]
Before you decide to elect yourself in the game of dope
Better know that it is cut throat
Can't be cracking under pressure when your backed in a corner
Against the ropes
They ain't calling it snitching no more
They calling it telling the truth
They say you better get down first
Before they decide to get down on you
Mixing it up, shake and bake
It's 2008, they got more data than '88
We used to make crazy cake, flipping weight
Gotta get in and out before it be too late
I don't want to be 6 feet under
So I pack and tote my thumper
Suckas want to hate and block my thunder
'Cause I got more kicks than a punter
Murder rates go up in the summer
Killers go hunting like a hunter
(How good can you live?)
You can live good for 6 years
But then it's football numbers

[Hook: Bun B & Brook]
First take 36 ounces of coke
Mixing it with water in a pot on the stove
Next step to make them boulders add, baking soda
If the flame is low then turn it up and stir it up
Finally, just wait till it gets hard
Then bag it up, you got a key
Homie, that's the recipe, t-t-that's the recipe
T-t-that's the recipe

[Verse 2: Gucci Mane]
Chef for the year, better yet, the fucking century
Dread head killers with me before dem up insolate
I'm in the kitchen scrapping up the pottery
Working with my hands like the maestro at the symphony
Sniff, I'm cocaine, shawty, take a wiff off me
Stiff a liffy pisso nigga come and comprehend from me
Talk slick to me, E40 style, you hearing me?
Got a green skirt and I bought it off a recipe
Hella p's, hella keys, yellow, purple, readily
Put me in the feds if these crackers on the recipe
33 yellow D's purchased off my recipe
Heavy cocaine in the G, plus I got a recipe

[Hook: Bun B & Brook from the Cooking Channel]
First take 36 ounces of coke
Mixing it with water in a pot on the stove
Next step to make them boulders add, baking soda
If the flame is low then turn it up and stir it up
Finally, just wait till it gets hard
Then bag it up, you got a key
Homie, that's the recipe, that's the recipe
That's the recipe

[Verse 3: Bun B]
Well, it's Chef-boy-R-Bun B, the king of the kitchen
I got exactly what you need to do your thing when you pitching
Guarantee to add a few layers of bling on your stitching
Bein' teeded in your chest get you stinging and itching
Got to have the right ingredients before you can start
Like one part gangsterism with one part heart
Two parts of keeping it G and add you one hundred
Milligrams of a killer, man and you'd had done it
Put it all inside a Cadillac with them 3's and them 4's
Swang wide and mix scurrily while skating on vogues
Don't forget to shake them haters off homie that's a necessity
Now you done made you a trill, nigga, now that's the recipe

[Hook: Bun B & Brook from the Cooking Channel]
First take 36 ounces of coke
Mixing it with water in a pot on the stove
Next step to make them boulders add, baking soda
If the flame is low then turn it up and stir it up
Finally, just wait till it gets hard
Then bag it up, you got a key
Homie, that's the recipe, t-t-hat's the recipe
T-t-that's the recipe",westcoast
11,Hood Boy,249106,17,78,The Ball Street Journal (Explicit Version),1,TRUE,13,11/24/2008,E-40,0.605,0.699,7,-5.729,0,0.0914,0.103,0,0.405,0.558,141.968,4,"[Chorus:]
I bet you ain't never seen 26's on a range
Iced out VVS stones and a chain
She want a hood boy [x4]
I bet shorty never seen a nigga pushin' that work
Gettin it, how he live stuntin on the turf
She want a hood boy [x4]

[Verse 1:]
(Ooh) She want a hood boy she don't want no mark
Body art on his arm's and neck and across his heart
They throwin up the block I represent my part
It's a zoo I got more animals then Noah's ark
I keep the bottles cracked I got the dro sparked, 44 cocked  and S65 parked
I'm a hood boy I be ridin wet,insides jelly touchscreen deck
They say you go boy I love yo swag and staljha
I remember fo' you rap you used to sell that yowder
Breitling for Bentley watch 26 inch socks
Pick a ride girl I got a car lot

[Chorus]

[Verse 2:]
(Ooh) I got paper but I be on the under
Every 3 or 4 weeks I change my phone number
Pope's be trying to watch me on some old shit
I give em  the same line I don't know shit
I don't want a model
I want some stretch marks,30 pound butt meat cheeks pull apart
Damn I be coonin', Japanese jeans on
Shorty on my line, she got me on her ringtone
She love me I like her, I'm too hood to wife her
I'm to hood to wife her, plus I got 3 just like her
I'm on this XO Landy,mixed with 40 water

[Chorus]

[Bridge:]
I can tell when she lookin at me (at me)
I can tell she want a nigga from the streets
She want that hood boy [x4]
I can tell when she lookin at me (at me)
I can tell she want a nigga like 40
She want that hood boy [x4]

[Chorus]",westcoast
12,Earl (feat. Ice T),258026,18,78,The Ball Street Journal (Explicit Version),1,TRUE,14,11/24/2008,E-40,0.501,0.716,1,-6.478,1,0.315,0.017,0,0.0981,0.467,82.012,4,"[Intro/Hook: E-40 X2]
Ex D-Boy used to sell that girl
Now, they know my name all across the world
They say Earl, EARL!!
They say Earl, EARL!!

[Verse One: E-40]
I'm from Vallejo, California, land of the homer
Sides lost lives, politics and drama
Over supersize, thump young in a hornya
Watch out for that boy in the hoodie, man, he a monster
Light a sucker up, fried buster like Chimichanga
Somebody come scoop his ass, call a coroner
I guess that's the way we bread
Chemical babies mislead
It's spooky out here in the Yay
These goblins will get on your head
These thundacat's management ain't scared to be deceased
They always cover up they ears
When I'm yelling and hollering out peace!
They going through it, they cranky, stressed out and tense
They starving, they hungry, they eating soup with chopsticks
Plus, it's a shortage on purple, and it's a drought on them bricks
So he'll go decide to do a kick door, and pull a few licks
Some of them parents on drugs, some of them never been loved
Some of them want to be thugs, some of them just need a hug

[Hook: E-40 X2]

[Verse Two: E-40]
I'mma be around for a minute
So get used to it, I was through with it
Before most of you marshmallows knew want to do with it
Pushing them zones, serving that drome
Balling like I play hoop with it
Never at home, always be gone
Doing a show on the verse split
Let it be known, I tote my chrome
Refuse to get caught loose with it
Looking down at my shoe with it, I'mma real baboon with it
40 over there slipping, he snoozing, he ain't wake
He looking like a plate, he chipped up and draped
You fuck niggas got me fucked up, nigga, I'm a shooter
Think about the consequences, nigga, I got gouda
And niggas with gouda will send a nigga, fuck a case
Cause niggas with gouda will have your whole family erased
But that ain't something I endorse, I only wore it by force
I'm trying to teach the youth to be loyal and play sports
Instead of in and out of court
And back and forth to prison, utilize they skills
And stay up out the system

[Hook: E-40 X2]

[Hook: E-40 X2]
I'm from Vallejo, California
The land of the homer
Sides lost lives, politics and drama
Sides lost lives, politics and drama
Sides lost lives, politics and drama

[Outro: Ice-T]
E-40 nigga, this ain't no motherfucking news to you, man
This nigga been running the motherfucking Yay
Running the motherfucking Bay for years now, nigga
These niggas don't play, this is Vallejo, California
Nigga, you heard about it
Iceberg, nigga",westcoast
13,Sliding Down the Pole (feat. Too Short),202360,43,78,The Ball Street Journal (Explicit Version),1,TRUE,15,11/24/2008,E-40,0.781,0.493,2,-5.745,1,0.186,0.261,0,0.788,0.303,97.924,4,"[Chorus]
There she go sliding down the pole
There she go sliding down the pole
There she is there she is
There she go there she go
There she is there she is
There she go there she go
Wow
There she go sliding down the pole
There she go sliding down the pole
There she is yea
There she go uh huh there she is yea
There she go wow

[Verse 1: E-40]
They say her brain is in her ass
But she really smart
All about her cash never been a mark raised in the
Trap seen a whole lot
Gluteus maximus shape like a heart
Legs spread apart trying to go to Clark
Looking for the light
But always find dark
Some of my folks like tricking
Some of my folks like pimping
Some of my folks spit rap
Some of my folks pitch crack
Give you a tycoon shower
Without the shower cap
I got the money and the power
Sprinkle you a stack there she go sliding down the pole
One dollar bills coming out her asshole

[Chorus]
There she go sliding down the pole
There she go slidin down the pole
There she is there she is
There she go there she go
There she is there she is
There she go there she go
Wow
There she go sliding down the pole
There she go slidin down the pole
There she is yea
There she go uh huh there she is yea
There she go wow

[Verse 2-Too Short]
There she go
Down the pole
Thats daddys little girl
But he don't know
If he finds out she’ll be in trouble
But if he dont her money doubles
Everyday she goes to work
Put her on stage they go berserk
I’m way in the back blowin purp
You throwing cash in the air
You suppose to flirt
She come out them draws ass everywhere
Dont keep her all night pass her player
Cause she’s my favorite yes she is
I wanna see her dance naked She’s the best in the biz
Bitch!

[Chorus]
There she go sliding down the pole
There she go slidin down the pole
There she is there she is
There she go there she go
There she is there she is
There she go there she go
Wow
There she go sliding down the pole
There she go slidin down the pole
There she is yea
There she go uh huh there she is yea
There she go wow

[Verse 3: Kurupt, Too Short]
Bigger than all outdoors
She got booty galore
Ass like I've never even seen before she cakey
She picking up her money off the floor
Its crazy all the ballers in the club know
Called the crib told my broad I
Ain't coming back home
I den found me another chick I wanna bone
They call me short
I’m nothin nice
Been hanging out in clubs all my life
Seen a wild ass stripper hair was bushy
Upside down with a bear in her pussy
Lay up on the pole she can sit on a roof
Slid back down she was getting it loose

[Chorus]
There she go sliding down the pole
There she go slidin down the pole
There she is there she is
There she go there she go
There she is there she is
There she go there she go
Wow
There she go sliding down the pole
There she go slidin down the pole
There she is yea
There she go uh huh there she is yea
There she go wow",westcoast
14,I Can Sell It (feat. Cousin Fik),300893,20,78,The Ball Street Journal (Explicit Version),1,TRUE,16,11/24/2008,E-40,0.817,0.577,10,-7.991,0,0.356,0.178,0,0.7,0.225,99,4,"[E-40]
Man I can sell anything mane (anything mane)
I got the mouth piece of a pimp

[Hook]
Who want it
Who want it
I can sell it
I can sell it
Who need it
Who need it
I can sell it
I can sell it
I got a gold mouthpiece
I can sell it (2x's)
Holla at me in the streets
I can sell it (2x's)

[E-40]
I can sell a flat tire to a bike
A left to a right
A root beer to a sprite
A dick to a dyke
A mute to a mic
Wind to a kite
Dark to bright
A shadow to a light
Cheese to pizza
Slut to a diva
Stripes to a zebra
Spots to a cheetah
Tall can to a liter
Sell sound to a speaker
A bucket to a Beamer
A scam to a schemer
Sell love to hate
The truth to lies
Sell real to fake
Sell shit to flies
Sell gas to Texaco
Insurance to Gecko
Tank full of petro
Minutes to metro
Hillbilly like Jethro
Magazines Street though
Screaming that Hillside (Hillside)
Straight up out the Valley Joe
It's Sick Wid It
In case you suckas didn't know
I can sell snow to a ski slope (Biatch)

[Hook]

[Cousin Fik]
I can sell mud to a worm
Sell a pimp a perm
Knock a bitch on a straight path
Sell her a term
Sell fire to a match
Ice to a freezer
Sell itch to a scratch
Sell credit to a VISA
Sell the club for street weed
Zip for zip
And fly to Iraq & sell extra clips
Sell sand to the beach
Fuzz to a peach
Get double for each
Sell lips to a leach
I can sell Buffy some ass
A bum some trash
Sell trees in a forest
Sell a yard some grass
Sell the future to the past
A blind man some glasses
Miles to a car
Cigar some ashes
Sell wool to a sheep
Dead man some sleep
I can sell some best friends some beef
Shit...
I can sell a shark some teeth
I got a nigga's nigga
Yall can get it from me

[Hook]

[E-40]
I can sell grapes to a vineyard
Chicken to the colonel
Keys to a custodian
Speed to turbo
Kicks to Beckham
Skills to a veteran
Pills to Excedrin
Joy to depression
Sell a bar some drinks
A coat to a mink
Sell some thoughts to a thinker
Psychologists to a shrink
I can sell weight to a gym
11 times outta 10
Sell rain to a storm
Sell blow to a horn

[Cousin Fik]
Look I can sell sugar to a cake
Water to a lake
Shoes to a snake
Shake to a quake
Wings to a boat
Sleeves to a coat
A page to a book
Some crimes to a crook
I can sell thin to frail
A shell to a snail
White to pale
Off to a scale
Grind to a block
Time to a clock
Silent to a rock
Detox to a knock

[Hook]",westcoast
15,Big Time (feat. Kevin Cossom),242560,14,78,The Ball Street Journal (Explicit Version),1,TRUE,17,11/24/2008,E-40,0.694,0.647,9,-6.194,1,0.256,0.0659,0,0.278,0.516,160.024,4,"[Chorus:]
If I got rich one day, I won the lotto
I'll be up in the club, drunk, poppin' bottles
Imma live it up like it ain't no tomorrow
Big time, big time, big time, big time
But I got to get it my way, I know it ain't pretty
Well, I'll be doing my thang till them boys come and get me
I'll be doing my thang till I run my whole city
Big time, big time, big time, big time

[Verse 1:}
I get to it, I hustle, I get it in, trying to win like Steve Wynn
Money long like Jay Leno chin, I didn't put nothing in my government
I paid my bills in money orders when I was in the trap hella heavy
When I used to quarterback that yolla
Perm down to my shoulders trying to get it while it's good
Til the po po's headquarters up a hub station in our hood
A lot of these rappers don't even sound like they believable
But you can ask your daddy and uncle about E feasible
They'll say he the gospel, he a for real fisher
He used to cop from me, now I cop from that nigga
Had to share the same bath water with my brother
Used to argue, fuss and fight over pillows and covers
The low man at the bottom of the totem pole
Used to go the Salvation Army for school clothes
Now I'm a whaler, tycoon bro, everyday is Christmas
Record company, real estate, food and beverage dealers

[Chorus]

[Verse 2:]
Pimpin' is ugly out here, it's gross
Best friend will try to sneak if you let him get too close
The body will fall if you kill the head
What else?
Lovers turn quick, they forget who buttered their bread
What was you tellin' them?
I was just tellin' one my dudes
They threw the old rules out the window
Created they own new set of rules
When the shit in the air
Be a man, you can't be scared
But you can't be
Try to nip it at the bud before it get too outta hand
Before what?
I got some real ones in the pen
That I visit cause they my folks
Up in there programming
What they making?
Making diamonds outta soap
Just got my car up out the shop
What you got in it?
Retarded knock
Use the loot that I won at a crap game
And painted it butterscotch
You can hear me throbbing up the block from miles away
My neighbours loose it
Po-po's pull me over at least 3 times a day for my music (ugh)
My over head 60,000 dollaz a month total
What else?
Conducting business on my sidekick T-mobile

[Chorus]

[Verse 3:]
Niggas on the money on a first name basis
And I ain't ate all day, I want my birthday cake
So if it ain't about the money, you can get it out my face
If it ain't about money you can walk the other way
Cause I always been about my dough
When they see you doing good, they want to catch you slipping
Cause them boys going to look out you know
That ain't gone ever stop me, now don't you worry about me

[Chorus]",westcoast
16,Alcoholism (feat. B-Legit),221200,24,78,The Ball Street Journal (Explicit Version),1,TRUE,18,11/24/2008,E-40,0.917,0.845,6,-7.429,1,0.303,0.0924,0,0.0377,0.743,104.97,4,"[Chorus][x8]
Alcoholism

[Verse 1: E-40]
Pull this bitch over my nigga, I gotta piss
I stay with some sip in my fist, I drink like a fish
Sometimes I be sober, but most the times I be blitzed
I'm having my Gouda, my nigga all on her bitch
We ball like we hoopers, my nigga we hood-rich
We winning not losing, my fella we got chips
I keep me a stapler, a pistol-grip four-fifth
Cuz I'd rather be judged by 12 then to be carried by 6
Don't wanna be carried by 6, I Rather be judged by 12
Suckas be all in my mix, Cuz I be up in their gal
Don't know how to read, write and spell
But I can add and count scrill
I can sell a rocks to a cliff
I can sell oil to a well
Yay area reppin, don't need no swagger injection
Big Oceans Eleven, hustling and money collecting
I'm shattered, I'm blended mayne, I been chiefing the seven
The po po's they tripping mane, they sobriety checking

[Chorus][x16]

[Verse 2: E-40]
The fur furs is crazy, Lucky I have me a ""desi""
A designated driver, a rider, we in it heavy
We knocking 40 Water, he foolish the boy gone
That's all they played was his music when I was in a group home
Bout to go slap some bones, shoot some dominoes with my fellas
Get on that Patron, called Stella Ella and Della
10 to get on the board, I'm fresh off the top
If I skunk you my ninja, you gotta drink two shots
Or we can play for some fedi, or we can play for pushups
Or we can put on the gloves, go from the shoulders box
After that we can hug get a room get props
All my fellas is thugs, ballheads dreadlocks
Slide out to the function, and continue to get bent
Last weekend it was smacking, my nigga that shit went
I left outta there with not one but two women
I guess you can blame it mayne on that alcoholism

[Chorus][x16]

[Verse 3: B-LEGIT]
13-hundred block ready rock animal
Sitting in the coupe, Orange like cantaloupe, something on the manifold
Gears in the rear, Olde English beer make it hard to steer
I been getting fucked up since the 9th-10 grade
Bird and grape Kool-Aid no ace of spades
I swerved and I do thangs I dance in the rain
And I guess this the money we gain the champagne
I pulls in the lot, bullets in the Glock
Hot boy or not B-lit like to shoot shots
Stop where I'm hot and I like to drink shots
And I'm gone off the Julio at the 20th what not
You can say what you say, Imma paper boy
Little waves up top, with the table boy
She be playing hard to get, but you can make them boy
Put some drink in her cup and watch her swish it up

[Chorus][x16]

[Outro]
Please drink responsibly don't drink and drive",westcoast
