index,name,duration_ms,popularity,num_markets,album,disc_number,is_explicit,track_number,release_date,artist,danceability,energy,key,loudness,mode,speechiness,acousticness,instrumentalness,liveness,valence,tempo,time_signature,lyrics,region
8,1-Luv (feat. Leviti),308306,43,79,In A Major Way,1,TRUE,9,3/14/1995,E-40,0.806,0.746,2,-5.473,1,0.151,0.0657,6.43E-05,0.127,0.417,90.038,4,"[Intro]
(Phone rings)
This is the operator. I have a collect call from
""Ay this yo' potnah, mayne!""
Who is an inmate in a California state prison
To deny charges, hang up now
To accept charges, press five now

[E-40 + Levitti + (Geraldine Michaels)]
Mmmmm..... welllll
One love (One love)
Ohhhhh (One love) The L, the L, the L, the L
One love (One love)
Welll (There's only one love) The O, the O, the O, the O
One love (One love)
Ohhhhh (One love) And the V, the V, the V, the V
One love (One love)
Welll It's the E, the E, the E, the E (There's only one love)

[Verse 1: E-40]
'Member that game Fat Bank Take Skinny Bank?
Well now we play Skinny Bank Take Fat Bank
That's because it ain't no work bein' offered main
They act like they ain't even thinkin' 'bout us main
I promise I swear the po-po threw my homie in the slammer
Did him bad, wish I had my candid camera, made me mad
Penelopes swarmin' like bees, surveillance binoculars hidden in trees
Reliable sources copping pleas, oh p-uh-please
One for the life, and two for death
Three damn strikes no chances left
Let me tell ya lil 'bout me, E-40 and the C-L-I-C
We used to have to use sheets for curtains, socks for washtowels
I was happy as hell when my cousin gave me his hand-me-downs
This ain't no happy Shirley Temple tale-listic crap
This here is serious, more realistic than Radio Shack
Observe as I strike a nerve, reach out and touch my kind
Open up your photo album, man, and I bet you find
Folks that passed away, potnas that been blasted away
I miss you, spill some liquor, mayne, who got some tissue?

[Chorus: E-40 + Levitti + (Geraldine Michaels)]
One love (One love) One love
Ohhhh (One love)
One love (One love) One love
Well wellll (There's only one love)
One love (One love) One love
Ohhhh (One love)
One love (One love) One love
Well wellll (There's only one love)

[Verse 2:]
Huh, e'rybody wanna shoot 'em up bang bang
Way I was raised we had to knuckle up and throw them thangs
We got em up and you know I had to check 'em swell
'Cause if I ran home and didn't fight back my mom'd beat that tail
Just received word from my folks upstate
They said uh, they tryin' to, they tryin' to take away our weights
And uh, no more beef and pork, just Muslim books and fish
Walking laps around the yard with my Walkman bumpin' this
Now I'm bouts to get married, is it clever?
Thought it was 'til I got the Dear John letter
Been down for ten months and got a eight-year stay
And I just found out she had her baby yesterday
Ain't nobody been to see me yet, but I ain't gonna worry
Mayne, ya out there ballin', mayne, can you drop a twamp up in my commissary?
Uhh, my family thinks that I'm a thug, homie
When you see my momma, man, give her a hug for me
And tell her

[Chorus: E-40 + Levitti + (Geraldine Michaels)]
One love (One love) One love
Ohhhh (One love)
One love (One love) One love
Well wellll (There's only one love)
One love (One love) One love
Ohhhh (One love)
One love (One love) One love
Well wellll (There's only one love)

[Verse 3: E-40]
Huh, thinkin' back, you gotta watch your back and play it well
Enjoyed myself when I was out there tryin' to get in that mail
We used to kick it at the Waterfront, the whole Vallejo
Watchin' the pervin contestses between E-40 and Del
That's what we did up under the bridge, fools posted up
Choppin' game, conversatin', gettin' toast up
Leanin' against my Zeniths, convertible tops and who's the cleanest
Them Click boys smobbin' deep in cuts, actin' meanest
The good times, they gone, here in the can is my new home
Guess in order to do some right I had to do some wrong
Picked up a package yesterday and I was HAPPY
It was a box full of goodies from my PAPPY
Tripped me out, ain't seen or heard from Potna Duke in years
Sent me a picture and some fetti, dang near sheddin' tears, huh
See, first you born then you live then you die
One day soon I'll get another try, 1-Luv

[Chorus: E-40 + Levitti + (Geraldine Michaels)]
One love (One love) One love
Ohhhh (One love)
One love (One love) One love
Well wellll (There's only one love)
One love (One love) One love
Ohhhh (One love)
One love (One love) One love
Well wellll (There's only one love)
One love (One love)
Ohhhh (One love)
One love (One love)
Well wellll (There's only one love)
One love (One love)
Ohhhh (One love)
One love (One love)
(There's only one love)
One love (One love)
Ohhhh (One love)
One love (One love)
Well (There's only one love)
One love (One love)
Hey (One love)
One love (One love)
Yeah yeah yeah (There's only one love)",westcoast
9,Smoke 'N' Drank,256933,26,79,In A Major Way,1,TRUE,10,3/14/1995,E-40,0.759,0.589,2,-8.158,1,0.296,0.0845,0,0.303,0.583,94.088,4,"[Verse 1]
(spit that shit)
Durrin a playa like my youth
I think I recall when I got my first tooth
I was a teethin little ol heathen perv off that philippe bombay juice
Some like a little further on down the line
Started fuckin with moonshine, all kind of wines
Stood in front of the liquor house soakin up gidname, from old timers
Buy me a drank man I know it's against the law im underage be a good sport
What you need my little comrade a packet of kool-aid and some whiteport
What else? A thing of beedies and a short neck of Night Train
Whatchu gonna give me? A crumpled up foodstamp that I won in a dice game
Preciate it playa, I'm up out of this bitch bout to go hook up
With my so-hid-nobs relatives simple ones kinfolks
Good folks, y'know, y'know
Twoasted, slerkin, me and my fools be out there back pervin
To' back on your face and start all over again

[Hook]
Let's perv, throw up, and drank again
Let's get high, loaded, and smoke again
(repeat 2X)

[Verse 2]
Just wakin up from my hang-over
Still high, like I swallowed an ounce of yola
Hell yeah I don't wanna ever be sober
Like bein toishin, wake up in the same position, open up the safe
Peep the stash, lookin mighty healthy, plenty of cash
Grabbed my faulty from up out the charger
And then made a dash called up the folks today is the day
For my nigga's birthday twelve o'clock come through he gon get beat
By who? By them hog mog niggas in the cleats
We's deep, no remorse no feelings retardos no sorrow
Drink it til your motherfuckin insides turn hollow (inaudible) cross and wallow
Back to back, struck and strikin, that's your job (that's your job nigga)
To make you lift this tick, fuckit nigga blow a bottle

[Hook]

[Verse 3]
Room spinnin, dead
Got the garbage can next to the bed
Now I was tweakin off that old crazy ass commercial on BET Jackie Stallone
What made it so bad is I don't even know how I got home
Niggas ain't feel me y'know fuck this surgeon general
What they need to do is legalize that indo
Dicked a, barren, purple, cush thou'
Smob with me I'm tryin to told ya like you get to perkin
Ride to me I'll teach you some of this game that I be twerkin
Pull this motherfucker over main, ya patna gotta go piss again
Don't even sweat it though just be on the lookout for so-and-so
Now whatchu be callin them po-po's? the dont-knows
Penelopes, grill up out of this bitch man
I got warrants, let's go get some Hen mayne

[Hook + Outro]",westcoast
10,Dey Ain't No,270960,24,79,In A Major Way,1,TRUE,11,3/14/1995,E-40,0.743,0.713,4,-6.986,0,0.281,0.0731,0,0.365,0.34,80.042,4,"Zap board beneath the ashtray, woofers in the back
Water in the duals make loud glass pack
Gold tippy toes without a lick of chrome
Bought a set of Vogues and left the, stickers on
Seven grand worth of bump for the trunks
Paid cash, all ones
Some old bitch came up to me and said, ""What's the latest, bro?""
I said, ""I'm tryin to have more chips than Las Vegas, ho""
She said, ""Can I roll with you? I get the dicks hard""
I said, ""You gon' work the strip, Sonoma Boulevard""
""How much would I make?"" I said, ""Mega
Just bring me back my scrilla scratch paper""
Heart (heart) money (money) street (street) hustle
Sex, drugs, smuggle, bubble
Horns, yellin, speakers, subbin
Sound just like the inside of a club, and...
How many times could a Conrad come so buttery?
Always on to' back, have people lovin me
Alcoholic drunk that ain't no gimmick, B
I'm always in and out the Betty Ford clinic, see
Drug paraphernalia cream butterscotch
Illegal like a garbage of hubba rocks
Workin off my pager, you know the ropes
I'm makin that cabbage cornbread like Oprah
Diamond satch-uels from ja-fuckin-home
Pose just like a pimp smokin a honey blunt
In a Major Way I tried to told ya
Niggas had my shit fucked back in the days but now they know'a
Sold a bunch of units underground
They was bumpin Save a Hoe in every town
Rumor has it that I died, I got smoked, mayne
But I'm alive, they was talkin about somebody else, mayne

*chorus*
We say dem niggas P.H
But dey really ain't knowin, dey ain't no
Me rather stack more papes
And steady get to bubblin, yeah fa sho'

Revenues, on my mind
I can't hold back, now's the time
Bust a dope addict crack fiend in the jaw
Fool had his spook on, tried to steal my car
Da Bay, where hoes be janky, sheist
And niggas, do so much dirt we got lice
Prices, go up and down like a teeter-totter
Filthy shit, ring around the collar
Just the other day I heard a Bootsy nigga shout
""Man that nigga don't be doin all that damn shit he talk about""
Fools think they know me think they got me figured out
But NIGGA... NIGGA!?!?
I plays this shit for bread and meat
So nigga if you feel froggish leap
I don't smoke dog food, sherm, loop or snow
But I leave a trail of bidis everywhere I go
So tell a friend like Alpha Beta
I'm gonna get it like T.C. the money maker
I know you're with it
Mayday mayday, unexplained object coming your way
Breaker breaker it's E-40 bitches call me the ahh
Ballin ass, tycoon talkin big wheeler
Money hungry, penny pinchin stingy nigga
On the sc-rilla, always on the go, get a
Super bad and we can split her

*chorus*

Me have no time for de bullshiters (4X)",westcoast
11,Fed,312266,27,79,In A Major Way,1,TRUE,12,3/14/1995,E-40,0.882,0.568,6,-9.555,0,0.242,0.00262,0,0.048,0.574,89.927,4,"[Intro: Samples & Suga-T]
There is something going on down here
In Vallejo
FedEx
In Vallejo, California
In Vallejo
In Vallejo, California

[Chorus: Suga-T]
He said he's just a
Timer, name ringin'
Major factor, FedEx
High-powered lawyers, and a
Young nigga havin' his way

[Verse One: E-40]
Lil' mannish ass nigga on restriction
Cryin' with his motherfuckin' nose in the corner
Broke up out of that old punk shit and said
""Momma I'mma do what the fuck I wanna!""
Hit the streets and make a wheelbarrow full of bread if I end up dead
Then press delete, I'm tired of eating potted meat
Within the nick of time a nigga hit the grind, so a dope boy scored a quarter key
Two hundred and fifty-two electronic milligrams
We'll sell rock coke candy, the organization
That I'm plugged with, they off into that old high-powered shit
These are the type of niggas that'll let a nigga know
When the drought about to hit, [?]
[?], post it on God
Because me got me scratch paper buried in the backyard
Me and my Click roll thick f'real don't be fakin' the funk like you a boss
Problems nigga? Let that go or get your head tooken off
Catch you out of bounds on the wrong fuckin soil
Wrap that ass up like aluminum foil
I'm FedEx, heavy duty nigga, pushin' weight (pushin' weight)
From sardines and Spam to Teriyaki steak; motherfucker ain't
But sixteen, fuckin' around with the skillet, makin' a killin'
Runnin' through three or four units a week on the over over puttin' the Whammy on 'em
(Whammy on 'em)
Cake up and baking soda, all that old shit
(What's your occupation?) Motherfucker I'm a timer

[Chorus: Suga-T]
Timer, name ringin'
Major factor, FedEx
High-powered lawyers, and a
Young nigga havin' his way
Let 'em know, let 'em know, mayne
Let 'em know, let 'em know, let 'em know, boy
Let 'em know, let 'em know, mayne
Let 'em know, let 'em know, let 'em know, boy

[Verse Two: E-40]
Bitch I thought ya knew, bitch I thought ya knew; huh, now check it
I'm to the point where I don't touch it no mo'
You probably got lieutenants and killers all on the squadron
With po-po's on payroll, huh
Lavish vehicles, they only make like fo'of
Front row seats at the fights, takin long expensive flights, huh
Qs, Ps, birth certificates and fake IDs
Like to drink liquor, with beedis in leaves
The motherfuckin fuzz wanna stop us
Found our fingerprints on some choppers
Listenin to the scanner, I hear the Penelope's say
""Man uhh, them nigga boys, I can't stand uhh""
Young hoodlums sellin' hop, cloggin' up the block
In they come anew six-double-zero drop
We party in mansions, VIPs nigga fuck a flyer
Invite celebrities like E-40 and J.R. Rider, timer

[Hook]
I'm so serious
I'm so serious, brotha
I'm so serious, brotha
I got m-

[Chorus: Suga-T]
He said he's just a
Timer, name ringin'
Major factor, FedEx
High-powered lawyers, and a
Young nigga havin' his way
Let 'em know, let 'em know, mayne
Let 'em know, let 'em know, let 'em know, boy
Let 'em know, let 'em know, mayne
Let 'em know, let 'em know, let 'em know, boy

[Interlude]
Hello?
Wassup fool!
What's happenin' who dis?
Nigga it's yo' boy!
My bo- wassup you timer, when your ass gone retire?

On a mission 'bout my mail to the Hillside of Vallejo (7X)

[Verse Three: E-40]
You niggas got me fucked, fucked up
Me yank myself up out the game? Hold up, motherfucker
I got bills to pay, nigga if you don't get out my way
I'm gonna peels your toupee
I'm in it to stay and I'm straight from the Bay
But I never woulda thought that I would feel like
That I can invest my money in a franchise
Get em up out the hood before my homies lose they lizzives
Buy a fuckin' record company and watch my mail rise

[Outro]
Ha ha, yeah, timer
Big timer, a motherfucker have his bread, man
FedEx to the highest degree, tax free
Ballin' out of motherfuckin' control
A major factor playin a white man's game man
Sneak in and sneak out
Campaign champagne and claim fame
Game can be sold and told at the same time
And this shit here is designed to sprinkle yo' mind
High-powered ass shit man for my high-powered ass Clickalation
Get it while it's good and look forward to graduation
Understand me?

[Chorus: Suga-T]
He said he's just a
Timer, name ringin'
Major factor, FedEx
High-powered lawyers, and a
Young nigga havin' his way
Let 'em know, let 'em know, mayne
Let 'em know, let 'em know, let 'em know, boy
Let 'em know, let 'em know, mayne
Let 'em know, let 'em know, let 'em know, boy
Timer, name ringin'
Major factor, FedEx
High-powered lawyers, and a
Young nigga havin' his way
Let 'em know, let 'em know, mayne
Let 'em know, let 'em know, let 'em know, boy
Let 'em know, let 'em know, mayne
Let 'em know, let 'em know, let 'em know, boy",westcoast
12,H.I. Double L.,283306,26,79,In A Major Way,1,TRUE,13,3/14/1995,E-40,0.779,0.661,11,-5.506,0,0.252,0.0589,0,0.058,0.668,170.128,4,"(E-40)
Hey ah, which way should I steer ah
The beat keeps knockin down my rearview mirror
Pervin like a mothafucka swervin
Hope I don't scrub in my '95 Suburban
To go throughout the community squattin on gold tippy toes
Peep, breathin on Indian cigarette-Ganish Bidi posin niggas tweak
Quick fast in a hurry, don't worry, 40 vision ain't blurry
Shorty hit the freeways right up the ways, clownin like that nigga Joe Torry
(Celly Cel)
Well, what do you know, it's siggity Cel
That funky niggaro, that funky nigga doe
Kickin in doors, you better grab ya ho
I see ya choosin in the late night
Creepin wit my nigga B-Legit and 40 Water, ah shit
(40)
We're here-we're there-we're everywhere
Highly intox-icated but we don't care
(B-Legit)
I'm from the H.I.L.L. the place where my niggas bail
A Mac muthafuckin 12 will send your ass straight to hell
(40)
A tick, a tock, they shook the spot
They say them crazy muthafuckas pulled out a chop
(B)
I watch them muthafuckas run
I do this shit for fun
You niggas know you can't get none
(40)
Biatch

Chorus-
I'm from the V.A.L.L.E.J.O
H.I.Double.L side doe
Spittin straight game is all a nigga know and ahh
And they be like... (there they go)
V.A.L.L.E.J.O
H.I.Double.L side doe
Spittin straight game is all a nigga know and ahh
And they be like... (there they go)

(B)
I tell a bitch what the fuck you mean where I've been
And so what I smells like pussy and gin
I had money to make
Bitches to break
And if the shit was out of line I had lives to take
I told you from the gate that I'm a mobster
Sippin DP, eatin lobster
Don't get it confused, you won't get abused
As long as you makin' me them revenues
(Cel)
That miggity mack, that diggity dang and that niggity nut
Jump in the back of my cut with a tramp slut and hit the guts
Ain't got no love for 'em, all I love to do is dick 'em
Pass 'em to the extra mannish nigga, 40 water, sic 'em
(40)
If I was Popeye I woulda told Bluto
'You could kiss my big black royal'
I'm not funkin' over Olive Oyl
Last night I had a superbad in my room
She sucked me 'til my dick shriveled up like a prune
(Cel)
Well pass the hussy to the left hand side
So I can bend her over, hit it from the back, and let her ride
You know a Sick Wid It hog gotta put the shake down
Shoot her to the left, nigga, hit me with that breakdown

Chorus
I'm from the V.A.L.L.E.J.O
H.I.Double.L side doe
Spittin straight game is all a nigga know and ahh
And they be like... (there they go)
V.A.L.L.E.J.O
H.I.Double.L side doe
Spittin straight game is all a nigga know and ahh
And they be like... (off to the liquor sto')

(40)
Beefeater, Tanqueray, Sapphire, Bombay
Either that or a punch bowl full of Hurricane Ethel
That'll last a nigga dang near all day
Smokin' herb, we gets perved, cop a squat
Let's hang out at the old Cola spot
(B)
Nigga, I'm a Looie, smokes damn near Q
So can I get a Twomp on my pager bill
You been blowin' me up
I know you know the code
31 double 07 dash 9 eleven
(40)
High steppin'
Ya blankin off the blanks
Cuz I'm a ""Rock star""
Here go dove rock, nigga, let me use your fuckin car
All the way through
Sunday,monday,tuesday,wednesday,thursday,friday,saturday
Threw up money tore up ass bootch you call the po po on me
Told 'em I was sideways doin about a buck 50 in Solano County
Sheriffs pull my ass over, and book me, caught me with a gun
And a bunch of Alizé bottles and they was askin me where I'm from
And I said...BITCH!

Chorus
I'm from the V.A.L.L.E.J.O
H.I.Double.L side doe
Spittin straight game is all a nigga know and ahh
And they be like... (there they go)
V.A.L.L.E.J.O
H.I.Double.L side doe
Spittin straight game is all a nigga know and ahh
And they be like... (there they go)",westcoast
13,Bootsee,256333,24,79,In A Major Way,1,TRUE,14,3/14/1995,E-40,0.832,0.651,1,-4.613,1,0.212,0.0285,0,0.381,0.348,90.058,4,"Bootsee let me define it you can rewind it after I finish spittin'
Now I want you to tell me if you know somebody in yo town that fit the description
A sucka, a ignorant mothafucka
One of them show boatin' high sidin' want to get some attention type nagas
Just as flashy but bitches be askin me
If they can borrow a couple of bucks until tuesday
Pleases that man go say no man be tryin to play Captain Save A Ho
Gettin marked by all them sneaky caniving ass set up hoes
You see bootsee is that ol' nigga with that ol' gold around his neck
Gold around his muthafuckin house, gold around his muthafuckin pet
Got everybody in the town thinkin' he sittin' nice on at least 20 ki's
But bootsee ain't movin nothin but half thangs
Straight fuckin with some of y'all niggas domes
Braggin and boastin, How can I make this shit look clean
Y'all really want to know who the man behind the fat sack well lookie here
Sho nuf ain't bootsee boss and thats for sure
Cuz bootsee be frontin himself off y'all niggas just don't know
The ones you least expect you know them square ass niggas in your city
They be the ones who have a grip , they be the ones who be sittin pretty
Instead of tryin to be super to start a fuckin track man
What a nigga really need to do is sit back and straight stack man
Cuz I've been on this Earth for 3 and some odd months man
Trippin off how these niggas out here be straight transforming
Laughing and smiling, loving and hugging a brother grinning
Turn around and talk behind your back the next minute
Bitch we call him bootsee

Chorus
Let me define it you can rewind it after I finish spittin
But what about bootsee
It be them bootsee muthafuckas in your town that's always dieying
It be them bootsee muthafuckas in your town that's always dieying
Bootsee is that busta with in no gizame
With in no gizame, with in no gizame

You's a loud talkin runnin off the mouth deeck
Wishy washy be puttin yourself on front street
Sloppy grindin, failizing, bitch buying pussy licka
That's what hella heads be sayin about that bootsee nigga
And ah
In case some of y'all ain't knowin this
Do to do almost anything to be noticed
Like ah
Pull out his whole bank account

And dang near everything he owns
And ah
Tell everybody in the hood that he got a chip in his phone
And how the fuck you gone be about you scratch when you gossip like a
Batch
And all them fools know where your stash be at
That ain't no sharp shit
Nigga that's that ho shit
Potna just keep on doin what you do and watch your perv get peeled
Ridin around here loose stickin out dumb like a soar thumb
Nigga tell the truth
Don't have a gun but I need one
You want to come up quick in this old shit so you can get it
But how the fuck you gone make your revees givin out credit
To tweakers, droamers, drifters, leftovers, geekers, zombies
Folks that steal from they mommies
When I was doin my thang I had strategy main
Sellin' that ""white girl"" you should have seen me main
You would have been proud of yo nigga cuz I was briliant wid it
I snuck in and snuck out without slippin in it
Get what you need out the game and sit your ass down
Invest your money

In some thangs and start clockin' pal

Chorus",westcoast
14,It's All Bad,207693,25,79,In A Major Way,1,TRUE,15,3/14/1995,E-40,0.809,0.592,6,-9.168,1,0.276,0.158,0,0.0683,0.598,84.894,4,"(E-40 and Droop-E talking)
Daddy
What's up?
What you doin'?
Sittin' up here marinatin', just, you know, trippin' off how this life is, man. Life is a trip
Well, what you writin'?
Just, you know, some ol' crazy, you know, some sh...my feelin's, you know?
Let me hear it

[Verse 1: E-40]
Why was I born in these trifling ass times?
Why is it mandatory that I carry knives?
Don't be too liberal 'cause, see, white folks get jacked too
Doctors, high-class lawyers and even Japs too
You ask me why I speak the real, the way I feel
How come we call bitches hoes and y'all call us niggaroes?
They wanna do me like they did Stax
What is this young black man doing with all that scratch? Huh
I see some timers on the yayo track readin' they mail
Talking about ""I got white girl for sale""
But they ain't talking to me 'cause see I'm an oldie and they knows that
I used to be just like them, I tell them ""Y'all get that scratch""
Magazine was never nothing like Bel-Air
High-speed shootouts and shit, but I loved it there
""40, where you been, playa? It's been a while.""
'Marinatin', accumulating paper, pal'
""Y'all kinda doin' it, huh? You still grindin'?""
'Hell yeah, you know them tapes you keep rewinding'
Money ain't changed me, money changed the way people think about me
When I was broke all I had was my family
You know what kills me doe, them fuckin' numskulls
I hate when blacks be clownin' blacks on all these talk shows
It's bad enough we shootin' up each other tragically
Two days ago they found some brother smothered badly
Nobody's to be trusted in this day and age
Too much jealousy and envy on the wrong page
And fuck the po po's 'cause that 39% tax I pay
Don't get me nathan but a chokehold and some pepper spray

[Break: E-40 & (Droop-E)]
(So is that what they do?) It's all bad
(It's crazy out there, huh?) It's all bad
(Is it gonna be like this when I grow up?) It's all bad
(Daddy, sprinkle me with some more game)

[Verse 2]
[E-40]
Our Father who art in heaven
Hallowed be thy name, thy kingdom come
That's the pray that I say so spread the word
And if you feeling down and out, read Proverbs
You know that I've been tweakin off, something strange
Startin' to see a lot of womens at the shooting range
Domestic violence but here's an old ghetto myth
My potna's auntie scold her boyfriend with some hot grits
I'm from the G-E double T-T to the oh no
Where only few dare to go
[Droop-E a/k/a Lil E.]
I spits game like a soldier, tonk since I told you this
The rap kingpin giant, six year old vocalist
You don't want to see me, do it like I do that
All up in your tall-can face, I tell you get more scrizatch
Y'all need to get up on it, the game is way to deep
I'm not your average hustler, I be creepin' while you sleep
Game, straight game
Get up on it, straight game

It's all bad (Repeat 4X)",westcoast
