index,name,duration_ms,popularity,num_markets,album,disc_number,is_explicit,track_number,release_date,artist,danceability,energy,key,loudness,mode,speechiness,acousticness,instrumentalness,liveness,valence,tempo,time_signature,lyrics,region
15,Outro,147600,19,79,In A Major Way,1,TRUE,16,3/14/1995,E-40,0.766,0.546,9,-8.893,1,0.114,0.346,1.11E-05,0.176,0.722,159.97,4,"[E-40]
Ugh, I heated up like an electric blanket [electric blanket]
I'm drunk as fuck
And I'm wounded and my breath stankin' [breath stankin']
I ain't gettin' this twisted
Holdin' on like a hubcap in the fast lane, in the car pool lane
Puffin' on some maryjane
Me and a couple of my commrads man
We some fools like dat
We live for dis
Ghetto, Gutter, and Gangsta shit like Mack Dime
I'm one vigorous sons of a bitch mayne I'm bout mine
Y'all know what I'll be doin' if I didn't know how to rhyme
Y'all know that the Water would still be out there on the grind
Shovlin', hustlin'
Livin' the dark side life of crime [life of crime]
Money and musclin'
Never workin' a 9 to 5 [9 to 5]
Rubber bullets and tear gas here come the task [task]
Lookin' for yayo in my coffee table harass [harass]
Me and my family on our naval layin' in the grass [grass]
Diggin' and chokin' from the pepper spray that they blast [That they blaaast]
They burnin' theyself out
They runnin' outta things to say
So they rely on WHO! E-40 Belafonte
The innovator, the king of the yay
The money motivator bustin' like a Chinese AK
Game poker rhyme sayer
The alpha and omega of the...RAP GAME
Playa from the hill Vallejo
My dictionary book of slang done finally came
Brought to you by Murder Dog Magazine, Magazine?
Magazine like my street
15 years in the game and I still ain't reach my peak
Be on the look out for the History channel me and $hort
Slidin', dippin' in my super sport
Glidin', tryin' to stay afloat like the love boat
Ridin' away, misbehave
Hit the turtle, blow some smoke man
Oh shoot I'm gone
I'm poked out
I'm twisted, stoned
I'm ugh
Talkin' bout the Pharmaceutical's biaaatch [The Pharmaceutical's]
Stovetop Productions, heavy on the grind intergamin' [intergamin']
Droopy on the beat
4-0, buy some
Wit the hurry up biaaatch
The Pharmaceutical's [The Pharmaceutical's?]
Yeah pimp, The Pharmaceutical's [Who is The Pharmaceutical's?]
Pimpin', that's my production team mayne
I thought you thought
On the planet earth nigga
Don't get it twited
Biaaatch!!",westcoast
0,The Ambassador,225213,24,78,The Ball Street Journal (Explicit Version),1,TRUE,1,11/24/2008,E-40,0.585,0.787,1,-6.91,1,0.566,0.22,0,0.0814,0.642,98.951,4,"[Intro:]
Sixty eight inches above sea level
Ninty three millions miles above these devils
Play me in the winter play me in the summer
Play me in the autumn-any order[x4]
Oohh
(Play me in the winter play me in the summer
Play me in the autumn-any order)[x2]
We gotta anotha one pimp (we got anotha one)
Rock with em up boy (we got anotha one)
Sick wid it records E-40 (E-40)
(Warner brothers)
Oohh

[Verse 1:]
I'm tryna get ma beak wet, I'm a let u shoot da dice and im a side bet
Still hungry just ate, medallion same size as a dinner plate
D bay ain’t been d same since I took a break
Whey you been 40? buyin real estate
I can't stop, play me fast fuck around and get mollywhopped
Just got my cob out da shop, wat color u paint it pimp  (apricot)
You never stop me in da function with a pink coat
Wippin da sweat off ma face with a c-note
They call me uncle 40 water the ambassador, the top tomata
And to all u sucka's tryina hate, 40 water doin great

[Chorus:]
I'm the ambassador, I'm the ambassador[x3]
I'm the ambassador of da yay (of da yay)
I'm the ambassador, I'm the ambassador[x2]
I'm the ambassador, I'm the ambassador
I'm the ambassador of da yay (of da yay)

[Verse 2:]
Play me in da winter play me in da summer
I'm a old schooler and a new comer
40 got spit ems ya'll he be gassin
After all these years he still smilin
Dats wat people be sayin  it's somethin about him he got some die hard fans (dedicated)
Real walkie people really care about him
Local boy made good ex d-boy made it out the hood
Got his gouda up to par, use to cook yola in a relish jar
If a sucka trip and try to suck us out the water
Don't just sit there and let him murder mouth yo partna
Teach his ass a lesson, toot him up and give him the thirty second blessin

[Chorus]

[Verse 3:]
I live in da bay with da stingrays and sharks, delta eighty eight bounty fields and sky marks
You can't be no mark marshmallows get pumped if they ain't got no heart
Thumper happy out here they like to clap
Don't get mad and come back
Get down where they mad at
We'll finish it if u start it,  air da club out like a muthafucka fart
Money maniac scorpio dats ma zodiac
Ain't nuthin new under da sun
I reach in my pocket and give my one's to da bums
When the homie go down we bail his ass out
We pass d hat around
I remember when they thought the west was a goner
I gave em cpr and brought us out a coma

[Chorus]

[Outro:]
Play me in the winter play me in the summer
Play me in the autumn-any order [x4])",westcoast
1,I'm on One,298653,18,78,The Ball Street Journal (Explicit Version),1,TRUE,2,11/24/2008,E-40,0.86,0.62,11,-7.906,1,0.23,0.0195,0.00518,0.0548,0.293,103.986,4,"[Chorus:]
Go hard, go hard, go hard (hard, hard) [x2]
4-3-2-1
I’m on one, one, one, one, one [x4]

[Verse 1:]
I’m on like a pot I cook up, I got the hookup
My slap makes the goonies look up, I got 'em shook up
Yolaology yayo college that’s what I took up
Northern California my nigga put up a shutter
On one, loaded like a shotgun
Smoking like a chimney, higher than the trees in Yosemite
Twisted like a pretzel drink a cranberry and kettle juice
Stay afloat keep my head above sea level
So much hate in my region, so much stress on the brain
Hey these rappers ain’t eating so they need somebody to blame
So they blame it on E-40 cause I got the biggest name
Nigga that been had no change since Soul Train
Step your bar game up, practice your penmanship
Stop complaining and making excuses nigga make a hit
Jus the other day I heard a fuck nigga say
40 ya’ll winning but Vallejo ain’t in the bay
I said that sound like some hoe ass shit a nigga like you would say
It’s haterz like yo washed up ass that’s in the way
Ooh, tycoon diamonds glimmin' like the sun
I’m in a fucked up mood, and a nigga on one
(on one)

[Chorus]

[Verse 2:]
Ooh smoking on smelly, pow round on my cellie
Hustling getting money as a habit, always getting dusty always in the traffic
Outta town outta state, doing shows making cake (ooh)
Spit them on stage like a savage, gulliest clubs with the grimiest bastards
Drinking is a ritual it make ma life easier, it’s not so difficult (it’s not so difficult)
I’m at the officiating table drinking shrimp pops
On this landi cognac som’n pitiful
I’m all purpose, I’m took, I’m lightly wounded, I’m lifted, I’m hecka twisted, sedated you don’t get it ah
I’m out of there in the middle of nowhere, I’m probably outta my mind on this liquor and don’t care
(I’m on)

[Chorus]

[Verse 3:]
Ooh, this yay boy, he on one, he get active this his gun
With the purple and Patrón finna take it to the dough, on one won’t stop till it’s all gone
Ooh, Marley naps American he don’t have arrest I hid on the outskirts but I’m from the trap
Ignorant black, jail waddy I put 12’s in the back, greenbacks, rubber bands thousand stacks
Secret stash box why I hide my mac, head out the sunroof bonking hella crack
Yelling hella loud, blank busting in the air for nutting shooting at the cloud
I ain’t listening my fellas say that I’m tripping,my homie still on parole my nigga he piss testing
Just got out the pot, just got out the shoe, just got through it doing 6 and ain’t supposed to be around this shit  (I’m on)

[Chorus]",westcoast
2,Break Ya Ankles (feat. Shawty Lo),240840,22,78,The Ball Street Journal (Explicit Version),1,TRUE,3,11/24/2008,E-40,0.679,0.653,1,-6.74,1,0.272,0.0589,0,0.507,0.537,85.012,4,"[Intro: E-40]
Show them how to break they ankles, mayne
Yeah, E-40 and Shawty Lo

[Hook: Shawty Lo]
Hey, let's go
From the West Coast to Atlanta
If a nigga gonna hate, well, got damn 'em
Hey! Go on an' break ya ankles
Hit the dance floor
Go on an' break ya ankles
Go stupid, get retarded
(Dumb, dumb)
Wake the game up, them boys made it
(Dumb, dumb)
Hey, gonna break ya ankles
We be the shit yaddamean
Go on an' break ya ankles

[Verse 1: E-40]
This a boy, this thang slap
I brought the whole hood with me, brought the whole trap
Mama, this your song, you know the lyrics
Go on an' break ya ankles, yeah, that's the spirit
Go nutty, go bananas, go berserk
Show them how to do it, let me see your foot work
We runnin' up a tab, havin' money so we spend it
Bottles everywhere, celebrating like we won the pennant
You recognize the fixture, you see the brightling watch
You get the big picture, you know that I'm a boss
(I'mma show up, I'mma show out
From the West Coast to the Dirty South)

[Hook]

[Verse 2: Shawty Lo]
Fresh off tour, I brought a mil' with me
Now the whole club gonna have to deal with me
Like Three 6, tear the club up
Like Pac-Man, cause I don't give a fuck
I'm throwing big bucks, cash everywhere
Shawty over here, 40 over there
You know the broads out cause the stars out
You see the parking lot, we brought the cars out
We going stupid, get retarded
And we ain't playin' with 'em, we came to party
I brought a lot of dough, I'm steady throwin' singles
So hit the dance floor, so go on an' break ya ankles

[Hook]

[Verse 3: E-40]
Do it like this, do it like that
Do it like this, then you do it like that
Break it on down, show 'em how to clown
Mean mug with it, let me see you rep your town
All street money, bonafide trapper
Never seen a check, ballin' like a rapper
80 on the arm, a hunnit on my neck
Shoe game sick, in the Bay we call it wet
More jewelry than the court room, glowin' like the moon
More jewelry than the court room, I'mma tycoon
Designer everything, throw it in the bag
I don't know how much it costs, I don't look at price tags

[Hook]",westcoast
3,Got Rich Twice (feat. Turf Talk),222920,18,78,The Ball Street Journal (Explicit Version),1,TRUE,4,11/24/2008,E-40,0.841,0.599,1,-4.927,1,0.349,0.326,0,0.115,0.168,101.951,4,"[Verse 1]
Hustler till I die, drink the bar dry then it echo that mannequin right back in the public eye
Drunk like mel Gibson get high got a ton of DUI’s
Lend a cognac sipping S.O. me and my guys doing a colossal
Living our lives trying to get this bobble head bobble to follow me in my ride so I can
Make like a denizen convince her to open wide kick her out when I finish take my balling ass
Back inside
Drunk terminology corner talk that's all I know California mentality ask about me pimp I go
You can check my record I don't like to feud but if I must I have your head severed
Screw your black living trap zones and projects, corner boy grit and crack apartment complex
Worldwide aside of the bens give me respect
The business will hit us victors and corporate execs

[Chorus]
E boy know where the boy too nice he’s done it again I got rich twice
Keep a thump untucked we ain't broke we papered up e-boy know where the boy too nice
He’s done it again and got rich twice
Keep a thump untucked we ain't broke we papered up

[Verse 2]
I cut him off like an umbilical cord turned off his lights we need to silence that brother his voice too strong on the mike
I make it look easy but its not im just doing feasy. why should I stop now pimp? the game need me. and do what he used to it . trying to get these million profits and moved and pushing and proving. loui like its rugged and ruggish my intellect. duckas suckas hollering and screaming my hood set 
They signing socks on my Chevy bosh shaking the cops I'm in it too heavy I can't stop. scamming plots, all my tombs are engraved blocks …(
Had my funereal on my block
The streets they don't play fair the mayor he realy dont care. Imma working three jobs trynna keep a roof on our heads. baloney sandwich used to peel the mold off the bread

[Chorus]

[Verse 3]
Tell a thug we got whatchu need if you bonie try to copy from me we unsoil you cuz see that its real black everywhere we go we burn hundred bills
Automatics and semis high performance and hemmys and the thicker the soil where we think buicks is bentleys
Coffee pots boil burn bland simmer and stew, im off of the soil ya’ll I hope you is too
Outta da bebede a cap you need a crew showing their underwear sagging thats what we do
Turf it trapping and stacking da money mackin surf it earthquake slap it and truk rapping
E boy know where the boy too nice he’s done it again I got rich twice
Keep a thump untucked we ain't broke we papered up e-boy know where the boy too nice
He’s done it again and got rich twice
Keep a thump untucked we ain't broke we papered up
Tell a thug we got whatchu need if you bonie try to copy from me we unsoil you
Cuz see that its real black everywhere we go we burn hundred bills

[Outro]
Got rich twice (damn!)
Nigga I done done it again (damn)
Bitch!",westcoast
4,Pain No More (feat. The Game & Snoop Dogg),265186,23,78,The Ball Street Journal (Explicit Version),1,TRUE,5,11/24/2008,E-40,0.432,0.854,7,-5.067,0,0.323,0.021,0,0.34,0.61,84.276,4,"[Intro: E-40]
E-40!

[The Game]
Chuck Taylor, Big Snoop, California's Finest!

[E-40]
West Coast!

[Hook]
I'm doin' everything I can to get my buzz on (Gotta get mah buzz on)
Tryin' not to feel this pain no more (No more, no more, no more)
That's why I'm poppin' these pills and smokin' this dro and drinkin' this henny straight
Tryin' not to feel this pain no more. (No more, no more, no more)

[E-40]
I came from the bottom of the barrel
To everyday new apparel, from a shoe string budget
To more jewelry than a pharaoh
About a place called Vallejo
House smaller than that hut
First city in California to go bankrupt
Came a long way let the truth be told
Penitentiary chances sweatin' over the stove
Seen 'em come and go, I'm the last of my crop
Don't compare me to nobody less ya talkin' bout Pac
Just tryin' to survive and stay alive
So many of my people done died
Now days, you an OG, if you live to be 25
My partner in there with his grand daddy, doin' 25
Liftin' water bags, doin' Burpees exercise
I hand pick my friends, cause people ain't trustable
Feelings like bras, their motives is questionable
Suckers sneak diss me then call me up on the phone
They say 40 Water I just wanna be on

[Hook]

[The Game]
Yeah
Hey yo 40
Let me talk to you for a minute, homie
They say money make the world go round
And since I'm worth 20 mil
I wanna see this bitch spin like the rims on a Schwinn
Hop on that bike, ride through the neighborhood
Compton on smash, them boys get cash
Money like Baby do, I gotta scar over my heart
Cause that's what hatin'll do
So watch ya back like a tattoo artist
A coffin don't give a fuck about who the hardest
You lay with the people who more pray
Get ya name etched in stone, witcha born day
Small talk over a glass of Grand Marnier
As I sip from the class, my mind starts packin' his Louis Vatton bags
Take a trip to the past, hear that shot gun blast
See my brother lying dormant, IV's in his arm
Can't you see he got piss bag?
17 years old and you niggas wonder why I'm so cold

[Hook]

[Snoop Dogg]
Let me get a fifth of Celandia
Plate of some candy
Cindy, Sandy, Mindy, Mandy
Tina, Brandy, Keisha, Angie
Man we, can we, all get a long
Two shots of patron
I did it till the break of dawn
Big fish in the pond, runnin' my triathalon
Doggy dogg, keep the bomb
One of a kind, blow yo mind just like Einstein
Blow and shine
I'm gettin mine, prime time like 21
Get 'er done, Everything in my life I make it look like fun
Every day of my life, I'm tryin' to get my buzz on
Cuz on, some on other shit, I'm keepin' it on the under, bitch
So much pain I over came, same thing
Me and 40 and Game came from the same gang
But you wouldn't understand
I'm populatin' wit my weakest translation
That's my main mane, let me hit that damn thang

[Hook]",westcoast
5,Tell It Like It Is,240146,14,78,The Ball Street Journal (Explicit Version),1,TRUE,6,11/24/2008,E-40,0.653,0.9,2,-5.221,1,0.372,0.249,0,0.13,0.524,89.073,4,"[Verse:]
How can I help you
What can I do for ya
Looking for that china white
Girl that's so soft
If I ain't got it
I know where to find it
If i can get it for you
Boss
How much you got in your budget
The more you buy the less it costs
I could front you a few off the side
As long as your ass don't double cross
You crossed a lot of racoons
Get your cranium sawed off
I got mouths to feed my nigga
I can't afford to take no loss
I can give your ass a number
Its up to you to keep it quite
You can't be a punk about the hustle
You gotta keep the money coming
I'm out here
Dealing with these suckers
Stopping the fake ass busters
They stab your ass in the back
These brothers turn on you
I know when its gonna be a shortage
How long this shortage suppose to last
I ain't got the weather channel
To predict the forecast
The plan is hustling
Cause there ain't no work there
Ain't no job
So they stuck in playing this game
And the next thing they gonna rob
Bite the hand that feed em
That shit right there ain't y’all
Two faced little ol’ heather
Working with the law
Man no matter what you do for  niggas
They ain't never gonna be satisfied
Tell it like it is
My whole thing is like
Why dudes be letting cats get in their ear though
Im just telling it like it is
I dont know what the fuck
Happened between ‘96 up to now
Nigga is hoes
I’ma tell it like it is
Man niggas is going out backwards man
Killas are snitching my nigga
Whats happening with  that
Tell it like it is
If there was a snake it would have
Bite ya
See you’ve been following so many nigga you wouldn't even know what hit ya
Now you don't know which way to look
You dont really know which way to turn
Got you trying to protect yourself
With all the bridges you done burned
You niggas cry to us nowadays
You niggas feelings get hurt too easily
Might as well wear a tampon might as well be a breezy
A closed mouth dont get fed
And a lazy hustler don't get bread
Pimping i can't read minds
I dont know whats in your head
Everybody think they know it all
Dont wanna hear nobody speak
Shut the fuck up and listen sometime
Even if you an o.G
Me personally  I'm a grinder
Can't let no grass grow under my feet
Dont nothing come to a sleeper but a dream
A vision without a plan is just a hallucination
I gotta lotta folks in the pen
Programming on vacation
I'm gonna give it to you straight
I ain't gonna give it to you late
Imma tell your ass whats real
I ain't gonna tell ya nothing fake
Man i got my own dreams
Everybody wants me to finance theirs
Tell it like it is
You know who i like i like that boy 40 man
He’s 20 years in the game and he consistent
Im just telling it like it is not all of them but a lot of these
New dudes is ringtone rappers man
Ima tell it like it is
Fools just have one album out
And act like they just it
Tell it like it is
Same song third verse
Its from the heart it ain't rehearsed
The world is full of associates but very few friends
Don't  wanna contribute nothing
But wanna help spend your ends
Think before you rocking your mouth
Park your tongue and lip
Watching who you talkin round
Never know who you're having dinner with
You ain't got nothing good to say
Dont say nothing at all
Thats what i was told
That's what i was taught when i was small
A lot of these so called artists got too much time on ya hand
Should be getting your money
On
Instead of hating on the next man
Its lonely at the top
But its next to crowded at the bottom
That's why I always keep my pistol cocked
In case i gotta stop ‘em
Stinkter(3:03)  in my lap
Trunk full of slap
Hollering at ‘em back
(3:06)
Pocket full of scraps
Nothing but thousand stacks
I’m old school acting a fool making my
Presence known
I look at business face to face
Dont like to talk on phones
When i'm at a stop sign or a red light I leave one car
Space in front of me
Tell it like it is
Just so i could have enough room to get up outta there
Just in case someone try to pop at me or something
Tell it like it is
Thats how i was raised
I'm still a student of the game
You could learn from a baby
I'ma tell it like it is
Man i was hollering at my grand partner
He said 40 return phone calls and you’ll keep your friends
Tell it like it is
Bitch
You two faced ass motherfuckers
I didn't just help create my music motherfucker
I invented it
Everybody wanna know what the fuck mob music is nigga this is mob music nigga
Poor ass motherfuckers
Bitch",westcoast
6,Give Her the Keys (feat. T-Pain),250800,15,78,The Ball Street Journal (Explicit Version),1,TRUE,7,11/24/2008,E-40,0.782,0.582,1,-10.062,1,0.0788,0.0588,2.42E-06,0.0944,0.399,105.057,4,"[Intro]
Yeah Mane!
Its magic!
E-40 and amp; my partna T-pain
(nappy boy!)

[Chorus]
Open up that garage
Its a big fat car
With a big fat bow on top (on top)
Its a Bentley Coupe with the roof let back
Now shawty you know that's hot
Ima give her the keys oh
And Ima give her the keys oh
Now shawty sang it to me oh
And Ima give her the keys oh
Ooo

[Verse 1]
From a bucket to a Benz
A Benz to a Bentley
Down with me from the start
Got my back like a tank top
When I used to be on the block
She hide my rocks in her yacht
Got a special place in my heart she know how to play
Her part
Everytime I look at you darling
I get a hard on
You sexy without your makeup on
I wanna bone
Move you out the hood
I told you I would
I’m not phony
We both from the same place
Grew up on fried bologna
They say the opposites attract
But we gotta a lot in common
Behind every boss player a boss woman
Imam fiend when it comes to your cooking
You do your thing
Throw down like Paula Deen
Neck bones and collard greens

[Chorus]

[Verse 3]
Born in the mud, raised in the trap
Down ass broad, never been a sap
If I ever needed bail, went to jail got popped
You’ll be Johnny on the spot you’ll come and get me out
A loyalist, not just a friend to me
We was meant to be
We got chemistry
You like it when I lay this pipe
Been around each other so long
They say we starting to look alike
Starting to think alike
Getting our money right
Fuss, fight then make love all night
California king on a California queen
My California dream we make a good team

[Chorus]

[Verse 3]
Its the little things that count any means much
Can't nothing come between us can't nothing separate us
You’re my backbone
You my rib
You my chick
You my backbone
You my rib
You my chick
Its the little things that count
Any means much
Can’t nothing come between us can't nothing separate us
You my backbone
You my rib
You my chick
You my backbone
You my rib
You my chick

[Bridge]
Yea mane!
Its a drought on loyal females mane
The good ones is hard to find mane
So when you find a good one
Hold on to that broad
Mane you hear me

[Chorus]",westcoast
7,Wake It Up (feat. Akon),238946,30,78,The Ball Street Journal (Explicit Version),1,TRUE,9,11/24/2008,E-40,0.71,0.762,3,-6.323,1,0.093,0.0154,0,0.324,0.432,107.704,4,"[Intro: Akon]
Konvict... {*jail bars close*}
Akon... and E-40, ohh yeah

[Hook: Akon]
I know you ain't used to havin real niggas like me around
I'm here to change to your whole life girl, so you don't deal with clowns
And treat you like a superstar that you are
Cause I'm a superstar too and I know exactly what I must do to make you...
(FEEL!) I'm about to wake it up, (FEEL!) See I'm about to wake it up
(FEEL!) I'm about to wake it up; don't it feel so good girl?
(FEEL!) I'm about to wake it up, (FEEL!) See I'm about to wake it up
(FEEL!) I'm about to wake it up; don't it feel so good girl?

[Verse 1: E-40]
I keep it 100's, don't carry nothing but 100's
I'm trying to wake it up, I'm on your line like Vonage
I'm a real one, ma, get rid of that clown, get with a factor
Patna don't count, he a lame he don't matter
Shining like a big dipper, glowing like a star
Lookin' up a paw, pullin' up in my car
Walked right up to the front where the bosses park at
I got a cold mouth piece can talk a chick out her check
Security loves me, let me in with no sweat
I see asian persuasion, caucasian, all kinds of chicks
Milk skin, chocolate boned, lambs and Haitians
Tryna take me something home and have some relation

[Hook]

[Verse 2: E-40]
Good God Almighty! Look at that body
What you holdin'? Girl you a banger!
You ain't off the back porch, you're off the Hanger!
You working with something, you gotta personal trainer?
Whole crew fine but you're one of a kind
You a ten piece, shawty you a dime
Back that thang up, baby press rewind
I'mma Scorpio, shawty whats your sign?
I'm just tryna know you, hold a conversation
Spoil you a lil', lightweight cupcakin'
Spend a lil gouda, get your hair done up
I'mma show you how a tycoon wake that thang up

[Hook]

[Interlude: Akon]
Don't stop get it get it
Bout' to jump up all in it
Love the way you drop low and bend it
Girl you're killin' me, wait a minute
Love the way you that shake it up
Too natural you to make it up
Won't be long for we wake it up
(That's right)

[Hook & E-40 ad-libs]",westcoast
