index,name,duration_ms,popularity,num_markets,album,disc_number,is_explicit,track_number,release_date,artist,danceability,energy,key,loudness,mode,speechiness,acousticness,instrumentalness,liveness,valence,tempo,time_signature,lyrics,region
6,We Want Eazy,300413,48,77,Eazy-Duz-It,1,True,7,1988-09-13,Eazy-E,0.711,0.926,7,-2.375,1,0.208,0.0243,0,0.385,0.528,95.108,4,"[Michel'le]
""We want Eazy!""

[Dr. Dre]
Yea, yea! Can yall hear that?
Can yall hear that?
Well, clap ya hands then-come on
Clap ya hands everybody
Clap ya hands, come on, come on
Put ya hands together and clap 'em
Now can y'all say Eazy!
Come on, say it

EAZY!
Everybody come on!
EAZY!
Who yall came to see?
Eazy!
A little louder come on!
EAZY!
Get those hands in the air!
Eazy!
Come on, come on say it!
Eazy!
A little louder come on!
EAZY!
Come on make some noise!
EAZY!
Ayo Ren lets do this

[MC Ren]
People from everywhere gather around
Checkin' out the sound that Eazy is throwin' down
With some help from Ren and Dre
Makin' a way with dope style
Yo Eazy, what ya gotta say

[Verse 1: Eazy-E]
A miracle of modern creation
Eazy E's on the set, hyped up with the bass
And a little bit of what ya love
From a brother who's smooth like a criminal
I mean subliminal - Otherwise known as a villain
Because I'm ruthless, when I spot a sucka, I kill 'em
But most I think know not to deal with me
Yo, it's obvious, tell 'em who you came to see

EAZ-Y...

[Michel'le]
(Michel'le)Eazy
Hey eazy
(Eazy)Wassup??
(Michel'le)Why you wear your pants like that?
(Eazy)I wear my pants like this, fo' easy access baby
Yeah thats right

(Ice Cube)
Yo homeboy, where we takin' this jam to?
COMPTON
Where?
COMPTON
Alright

[Verse 2: Eazy-E]
Yeah 'cuz this is the way I know you like it
So you won't strike it
I took it and I hyped it
And now that it's done, I know ya pleased
At how the E just duz it with ease
Just imagine a crowd screamin', a girl dreamin'
Just to get a picture of me 'n' my B-O-Y-Z
From the H-double-O-D
N.W.A., down with me
Strong 'n' I'm ragin'
Turn the page 'n'
See I'm not a son of a gun
I'm a gauge 'n'
Nuthin' can avoid this shot cause it's hittin'
It's so cool when you touch it, wear a mitten
I'm comin' off raw into ya speaker
Makin' the suckas on the street feel weaker
But most I think know not to deal with me
Yo, it's obvious, tell 'em who you came to see

EAZ-Y...

Yo man, you weren't born in no '73
Why you be lyin' bout your age?
(Eazy-E)
Man, why you gotta bring that up?
Yo, get this fool outta here!

Hey Eazy why you always cussin' on your records?
(Eazy-E)
Who are you, Gene Autry or somethin'?
I just do that to get my point across
Now I wanna know who you came to see

EAZ-Y...

[Verse 3: Eazy-E]
Aw, never, I'm just too clever
So, in fact, that no one can sever
A blow from a maniac and yo, I make it clear
So a register is all I hear
Money overturned, then I jet
To make another hit, for you to go and get
Record stores sold out because you love it
Another example of how Eazy duz it

EAZ-Y
We want Eazy...",westcoast
7,Eazy-er Said Than Dunn,219946,51,77,Eazy-Duz-It,1,True,8,1988-09-13,Eazy-E,0.866,0.818,8,-4.111,0,0.26,0.0137,0,0.132,0.747,103.332,4,"[Dre]
Yo man I don't think they heard you
Why don't you tell 'em what ya name is

[Eazy-E]
My name is Eazy yeah this is true
Keepin' your attention is what I'm gonna do
Hardcore yo I could never be soft
Askin' me my defin' they say the boy goes off
Fillin' up my memo with the touch of my rhyme
Suckaz stayin' with me cause they know the time
Quiet on the set because I'm about to begin
And if you didn't hear me boy I'll tell you again
My name is Eazy or just call me E
But It doesn't really matter to me
Cause I'm the same person
Whether serious or rehearsin'
I just gotta keep cursin'
This is for the radio so I better chill
They won't play it if I cold get ill
But I'm like that and thats an actually fact
Because the street is where my heart is at
Yo I don't do dope but I'm dope not a dope
But I'm doper than anybody who tries to cope
If the rhyme I'm displayin'
And the beat that's playin'
Yo you could try all day
And you still won't match up with the Ruthless P.O.W
Cause Eazy's doin it Compton style
Thats the city and you say you could get some
Yo it's Eazy-er Said Than Dunn

[Hook]
Wooooooo!
Wooooooo!

[Eazy-E; MC Ren]
Now it's easy for me to get my point across
So listen up close if ya don't ya might get lost
I'm not a role model or a Dr. Seuss yo I'm a gangsta
And I'm about to get stupid
I guess its time for the trama
With the E-A-Z-Y-E comma now that's drama
So pay attention by the way I must mention
I'm comin' off hard in the third dimension
With the glare
But you don't need no glasses to stare
It'll probably take you in and it's just like you're there
With the E on the gangsta tip
So if you think I'm a flip or slip don't even trip
Cause I'm a destroyer
My homie Dre is a doctor not a lawyer
Dope MC employer on Ruthless and that's my label
To get the money, the women, and cold bust the fat cables, boy
Master Rhyme's a toy
I mean straight, while you suckin' with the girls enjoy
You must be sick, or you lonely
How you gonna diss me if you don't even know me?
Yo Ren!
Whassup?
Get the gat show 'em where it's at
And that's just the sound
And next time I'm peelin your cap
To let you know where I'm comin' from
Eazy said it and it shall Be Dunn

[Hook]
Wooooooo!
Wooooooo!

[Eazy-E; MC Ren]
Creating dope jams is a part of the cycle
Eazy-er said than Dunn yeah thats the title
Rubbin' the lady's only the fly ones ya know
But what if she's ugly?
Eazy come Eazy go
Don't ask to battle me, homeboy, what's that?
You wanna battle me, boy ya better be strapped
Cause where I'm from it ain't all about that playin'
[*gun shots*]
Now that's what I'm sayin'
Said before that I was born in '73
Now everybody wants to know the A-G-E
Girls on the tip, fellas too, it seemed
Had everybody thinkin' I was only 15
The fellas would annoy me
The ladies would adore me
And what was I to do
I wishin' nothin' but to let the lady's through
Cause the ladies I love 'em
Nice and then soft
I hate male groupies so just step the hell off
I'm the real Eazy cause others be fakin'
Tryin' to game fame off the name I'm makin'
Sayin' on your records you could get some
Yo home boy its Eazy-er Said Than Dunn

[Hook]
Wooooooo!
Wooooooo!",westcoast
8,Radio,297466,41,77,Eazy-Duz-It,1,True,9,1988-09-13,Eazy-E,0.852,0.863,10,-4.005,0,0.311,0.0438,0,0.434,0.942,95.105,4,"[Intro]
Greg Mack: This is radio station K-EAZY-E
Hi, this is Greg Mack, Mack Attack, and we're gonna go to the phones right now and find out what's goin' on. Hello, who is this ?
MC Ren: Yo, what's up? This is Lorenzo Patterson
Greg Mack: Yo man, where you calling from ?
MC Ren: I'm calling from Compton and I wanna hear Eazy E's new record
Greg Mack: What's it called man?
MC Ren: Yo, it's called ""Radio""
Greg Mack: We got it, you called the right station. And here it is

[Verse 1]
Eazy E rockin' non stop on the radio
With the funky fresh hip hop in stereo
Release some rhymes that you will find demandin'
With Dre's beats that are so outstandin'
I'm gettin' busy if you know what I mean
Always settin' me a mark in the hip hop scene
On the radio the greatest of all times
Like Muhammad Ali cause I punch rhymes
So tune your station, and clear all the static
And tell the truth: you didn't know that I had it
In me, to be easy about the situation
So just kick it and listen to the station
Playin' my music, it's hard to lose it
It's constantly on request cause you choose it
I'm Eazy E, my rap is strong
And your radio's def when my record's on

[Hook]
[You wanna know why...because...]
I'm on the...
[Radio (echo)]

[Interlude]
Dr.Dre: Yeah, ruthless radio is in effect, Dr. Dre and Yella boy is in ya system, and right about now we got Eazy E and MC Ren in the studio taking calls. So give'em a call and ask'em how they're doin'
*Ring*
Eazy-E: Hello, this is Eazy E. What's your name ?
Joyce: Hi, this is Joyce, I'd like to know if I can have your phone number?
Eazy-E: Yes, it's 9-7-6...
*Click*

[Verse 2]
Now I wanna turn up my box, and make much noise
And rock the party and shock all the B-boys
Take on my radio from phono to tuner
I wouldn't have did it, later but sooner
Now I move my antenna to the center
Then grab a hold of the handle and enter
Then bust a rhyme, you know I won't quit it
Am I lyin', Ren ? (Man, you know you're with it)
Your request is clear, that you're givin'
Without Eazy E you wouldn't be livin'
With me on a top 10, or a mix show
So hit your power button, and let's go
On vacation, with your station
That's playin' live in every location
Blowin' out ya speaker
It won't get weaker
I'll keep rockin' till I hit the peek
And your station is dope E-A-Z-Y
It's on the air, but you axe why
I took out the cursin', and took rehearsin'
I feel dry, you know that I'm thirstin'
To get busy; I don't quit it
And once you hear my cut, I know you're gonna get it
Then bust a rhyme, while you're clappin' your hands
It's Eazy E on the air (rockin' without a band)

[Hook]

[DJ]: You're on the radio, on K-EAZY-E, with Greg Mac. Don't forget to
Join us this friday night live, we'll be jammin' it uptown with my
Homeboys Eazy E, of course, N.W.A. and the whole Compton posse
Can't make it out but, hey, stay eazy, and stay it on K-EAZY-E...
With more...radio

[Verse 3]
Now disc jockeys are playin' me in rotation
Hittin' number one spots across the nation
I'm on the charts, you can go list'em
But now listen, I'm on your system
AM or FM, I'm in power
You hear my music once every hour
So listen up to the rhyme and percussion
But do this with no discussion
Eazy's easin' fans I'm pleasin'
Why, I'm on top yo, I got reason
With no profanity, but what can I say
Yo Dre (What up ?) Do it your way
On the radio you get more looser
Take my word you're a dope producer
We combine to put out hits
But jealous people, they just have fits
Cause we get airplay, but we're not thru
Dre, am I serious ? (Cold word) Well thank you !
People that hear me, they know what I'm sayin'
On the air, I don't be playin'
Just gettin' my point across to the public
Rhymin' on the radio, that's my subject
I can play (rock), but I prefer (hip hop)
It's Eazy E on your radio non stop !

[Hook]

[MC Ren]: Yo, this is MC Ren, can you comprehend ? We're for bite just like TNT. Yo, what's the time?
[Girl 2]: Hi, my name is Tushie and I'd like to know when your 12"" record is coming out
[MC Ren]: Yo, it ought to be out real soon, so just keep looking in your local record store!
[Stan the Guitar Man:] Yo, can I speak to Dre?
[Dr. Dre]: Yo what's up? This is Dre
[Stan the Guitar Man:] Hey Dre, this is Stan. Remember me?
[Dr. Dre]: Yeah man, I remember you! What's up, homeboy?
[Stan the Guitar Man]: Yeah man, I play guitar on this record! I wanna know when I get Paid, motha...?
{Plop}
[Dr. Dre]: You got ganked...
Hello, you're on the air. What's up?
[Girls]: Hello, we'd like to speak to that cutie pie DJ Speed
[DJ Speed]: Yo, this is DJ Speed. What's up?
[Girls]: The joke's on you, Jack! Hahaha!
[Dr. Dre]: Hello, you're on the air
[Guy 3]: Hey, what's up ? This is Nasty Naz callin' from Seattle
[Dr. Dre]: Hey, what's happenin', homeboy?
[Guy 3]: I'm callin' to be on Eazy E's new record, ""Radio""
[Dr.Dre]: Man, you're late. The record is already o...",westcoast
9,No More ?'s,234360,51,77,Eazy-Duz-It,1,True,10,1988-09-13,Eazy-E,0.935,0.805,7,-4.782,1,0.225,0.0143,1.53e-06,0.298,0.624,105.641,4,"[Intro: Eazy-E & Female Interviewer]
We're sitting here with Eazy E
Believe that
How are you doing?
Alright
So, Eazy, tell me, how was your life as a youngster?

[Verse 1]
Ruthless, my style as a juvenile
Ran with a gang, slanged in the meanwhile
Bankin', I specialized in gankin'
Whites, Mexicans, brothers and others
Daily, it's all about comin' up
Makin sure no punks are runnin' up
(​Because I'm a gangsta havin' fun)​
Strapped with a gat when I'm walkin through Compton
Terrible, I never listened to my mother
It went in one ear, and out the other
Ran my gang, sold undercover
Call a girl out a name, yo I ain't no lover
I'm a pimp, mack daddy, lookin' for the dollar
At thirteen I bought a six-fo' Impala
Rollin', and runnin' from the police
Brother don't you know you can't trust a thief
Or thug, convict, hoodlum or criminal
Leave your car open, gank for your stereo
Hard and raw, no regard for the law
(Eazy E, were you ever caught slipping?)
Hell naw! Just trippin' off 8-ball
And girls ain't nothin' but female dogs to me
Bitches! I'm sorry for that verse
It's in my nature, I gotta curse
Out anybody gettin' on my nerves
You get beat, ganked, broke and served
So... you know who I am
And if you don't like it, I really don't give a damn

[Interlude: Eazy-E & Female Interviewer]
Hmm, I see, so you're rather violent?
Sometimes
Ok, what would be the situation when you so-called ""gank"" someone?

[Verse 2]
Wait... for some people to leave
I got another trick up my sleeve
Step with pep to the back of the house
Looked in... all the lights are out
Grabbed the door and it's locked, so
Easily made my way to the window
Lift it up slow, 'cause it takes timing
Looked around, and then I climbed in
Once inside, I start takin'
'Cause you know it's no time for shakin'
Get what you gonna get, front and center
Or get five years for breakin' and enter
Move quickly, but no runnin'
Shh, I think somebody's comin'
Hear the front door key, and I flee
Out the back with a fist full of jewelry
Over the wall... don't fall
Wipe my sweat 'cause that was a close call
Gettin' ganked by the E is a lesson
So... is there any more questions?

[Interlude: Eazy-E & Female Interviewer]
Yes, as a matter of fact, there is...
Have you ever been involved in, like, an armed robbery or a hold-up?
You mean a 211?
Yeah

[Verse 3]
There's a store, but don't point
Walk inside, case the joint
One man behind the counter, another in the back
Go out to the car and load the gat
Grabbed the ski mask, here's the task
Go in broke, come out with cash
(Were you slick?)
Yeah, you gotta be cunnin'
Told Ice Cube to leave the car runnin'
Walked in, said: ""This is a robbery""
Didn't need the money, it's just a hobby
Fill the bag, homeboy, don't lag
I want money, beer, and a pack of zig-zags
The man in the back had a camera
So he came out to test his stamina
Against Eazy E, but he took one
Fell to the floor, so I run
Back to the bucket, then I said: ""Punch it""
Took the gun, and then dumped it
I'm not like Robin Hood, 'cause I want more
Steal from the rich, hang with the poor
My pockets are fat, you see, it don't matter to me
I feel like nobody is badder than me
(Is all that true?)
I don't lie
You see... I'm not mister nice guy

[Interlude: Eazy-E & Female Interviewer]
Oh, so you're not exactly a role model?
Not exactly
And for your listeners, what does Eazy think of himself?

[Outro: Eazy-E & Female Interviewer]
Bad and bold, you can't get with this
Those that tried, you're on my shit list
Can't be caught, sought or fought
Thought, and damn so what?
Down and dirty from the C-P-T
N.W.A and Eazy-E
One more, before we end this session
What's your real age?
No more questions!",westcoast
10,I'mma Break It Down,207493,33,77,Eazy-Duz-It,1,True,11,1988-09-13,Eazy-E,0.961,0.927,3,-4.37,0,0.227,0.111,0,0.0771,0.659,115.729,4,"[Verse 1]
My eternal jam is the juice of the radio
Takin' out profanity so they can play it though
Listen to a hell of a kick and the hi-hat
Going to the record store say ya gonna buy that
The E is connected to the A and the Z ya say Y
So that's how the beats stack it up on material made of hits
Takin' my time of Eastline to make sure it fit
Push play on the instrumental thats recorded
Step on stage and I'm suddenly awarded
Some sort of trophy like a plaque
And some hell of a scream from the girls in the back
Takin' a bow 'cause I got style
Never at the bottom of the ways on the top of the pile
Yo it's Eazy on top even though I'm short
Guarenteed to help when I walk on the court
So get up make some noise for the gangsta clap
Don't attempt the laugh I'm not a pranksta
I'm serious create sounds so quit playin' around
'Cause I'ma break it down

[Verse 2: Eazy-E +  MC Ren ]
Last time I was takin' my time with this
But other suckas were makin' a rhyme with this
I had to change the tempo or make it hyper
But they was rotten, I was gettin' riper
Ready to go, like never before
Givin' you more because I'm ready to score
Ren is my buddy you can tell I said often
Helpin' me destroy the suckas that soften
Curin' diseases, my rhyme pleases, throw it a key
Balls havin' seasons, this is a doctrine
And I'm locked in, and I made up my mind
And I think I'm gonna rock then
You got bitches chill and I'ma push ya
To freeze after I'll cut ya 'cause I'ma butcher
And say ya have pricin' and then out ya go
'Cause a percentage on pork bellies are very low
Messin' with a gun but once ya get hurt
Like a said before ya get rushed to the dirt
I'm not a lawman, but I'ma raw man
But ya the dopest one I ever saw man
I keep droppin' it pound for pound
And when I'm on the mic I always throw down
To keep y'all dancin' to my funky sound
So listen up, 'cause I'ma break it down

[Verse 3]
Now look at me and not the poster
And you could see right off I got the most of
The talent, experience or a trade
And compliments for the rhyme that's made
Talks over today if this one so
Pick another artist and dis one
I got the ballet of the chosen vote
'Cause I don't need water to clear my throat
Comin' from the rain the show is like dancin'
Nasty like and the girls are like glancin'
Wantin' to get wit me this routine
Keepin' it sprung still stayin' mean
Can ya dis this man I don't think so
Once I start writin' the way I let the ink go
Comin' out with songs like hit after hit
'Cause this is legit and yours ain't shit
Makin' it sound so dope 'cause I'm a genius
But your amazed with ya happy to see this
Brother go crazy on wax
Flowin' away like if I was on a sax
Doin' a solo in the shade, I'm a spotlight
Relax and chill while your uptight
Pumpin' up the funky sounds
Yo, you should know it's kinda persist
That the E is gonna break it down",westcoast
11,Eazy - Chapter 8 Verse 10,129613,28,77,Eazy-Duz-It,1,True,12,1988-09-13,Eazy-E,0.642,0.99,6,-4.091,0,0.43,0.0203,0.000183,0.271,0.377,116.501,4,"(Alright, go)
This comes from the E Chapter 8 verse 10, and it reads:
It's time to put some niggas in check
When you shoot a gun, hot shells eject
Catch 'em they get used as evidence
Only when they get brushed for finger prints
You ask why am I like this
Cause you wanna hear about shit like this
So I tell it how I know it, just hope the fuck I don't show it
Niggas out frontin', loitering and looting
Let's recreate a drive-by shooting
More brothers in a car blocks away
Waiting to spray, shotgun, Mack-10 and an AK
They roll through to a line of niggas
It was 9 just like the fuck they figured
Go around tha corner come back real slow
Lights off, car's in neutral, rollin' at a snail's pace and creepin'
Hoping to catch all of them sleepin'
A so-called gang, drugs and sex (NWA)
Start busting a cap and all the others jet, 3 of 'em fall to their doom
Pronounced dead at the scene, with gun shot wounds
3 dead because Compton is scandalous
I'd like to tell you, brother, ashes to ashes, dust to dust (Amen)
Da da da
(You will now witness the sound of TV Ang-Ang-Angels)
(We will now pass around the hat)
(That's good enough)
No it ain't, you fucked up, you fucked up (it's cool)
No, it ain't",westcoast
12,We Want Eazy - Remix,398160,29,77,Eazy-Duz-It,1,True,13,1988-09-13,Eazy-E,0.677,0.935,4,-3.067,0,0.206,0.275,0,0.964,0.631,96.832,4,"[Intro: Dr. Dre + Eazy-E]
(We're ready?)
Eazy!
We want Eazy!
Who'd y'all come to see?
Eazy!
Tell 'em who you came-, Tell 'em who you came-, Tell 'em who you came to see
(We want Eazy)
Yeah, yeah!
Can I get down one time?
Yeah, you know what time it is
Ayo yo yo, let's make it funky right here
Put yo hands-, put yo hands-, pu-, pu-, pu-. pu-, put you hands together
Aw, yeah
Put yo hands-, Put yo hands together
(And clap your hands to what he's doing)

Eazy!
Everybody come on!
Eazy!
Who'd y'all came to see?
Eazy!
Come on, come on say it!
Eazy!
A little louder, come on!
Eazy!
Get those hands up in the air!
Eazy!
A little louder, come on say it!
Eazy!
All of me
Why not take all of me?
Eazy!
Yeah, yeah, yeah!
Eazy!
Who y'all want?
We want Eazy!
Tell em who you came to see
Eazy!
Ayo Ren lets do this
We want Eazy!

[MC Ren]
People from everywhere gather around
Checkin' out the sound that Eazy is throwin' down
With some help from Ren and Dre
Makin' a way with dope style
Yo Eazy, what ya gotta say

[Verse 1: Eazy-E + Dr. Dre]
A miracle of modern creation
Eazy E's on the set, hyped up with the bass
And a little bit of what ya love
From a brother who's smooth like a criminal
I mean subliminal - Otherwise known as a villain
Because I'm ruthless, when I spot a sucka, I kill 'em
But most I think know not to deal with me
Yo, it's obvious, tell 'em who you came to see

(Eazy!)
Everybody, come on!
(Eazy!)
A little louder say it!
(Eazy!)
Come on, say it, say it, say it!
(Eazy!)
Come on, everybody, come on!
(Eazy!)
Who'd y'all come to see?
(Eazy!)
A little louder, come on, say it!
(Eazy!)
Come on, come on, come on, come on, come on
(We want Eazy!)
Ayo Yella boy, take me to the bridge

[Bridge: Dr.Dre]
(Get funky with it)
(Get funky with it)
(Get funky with it)
(Get funky with it)

(Eazy!)
Everybody in the house!
(Eazy!)
Come on, say Eazy, Come on!
(Eazy!)
Come on, say it, say it, say it!
(We want Eazy!)
Ayo Eazy, kick me another verse

[Verse 2: Eazy-E + Dr. Dre]
Yeah 'cuz this is the way I know you like it
So you won't strike it
I took it and I hyped it
And now that it's done, I know ya pleased
At how the E just duz it with ease
Just imagine a crowd screamin', a girl dreamin'
Just to get a picture of me 'n' my B-O-Y-Z
From the H-double-O-D
N.W.A., down with me
Strong 'n' I'm ragin'
Turn the page 'n'
See I'm not a son of a gun
I'm a gauge 'n'
Nuthin' can avoid this shot cause it's hittin'
It's so cool when you touch it, wear a mitten
I'm comin' off raw into ya speaker
Makin' the suckas on the street feel weaker
But most I think know not to deal with me
Yo, it's obvious, tell 'em who you came to see

(Eazy!)
Everybody come on!
(Eazy!)
Get those hands back in the air!
(Eazy!)
Come on, say it, say it, say it
(Eazy!)
Come on, everybody, come on!
(Eazy!)
I can't hear you
(Eazy!)
A little louder, come on, say it!
(Eazy!)
Come on, say it, say it, say it
(Eazy!)
Ayo Yella boy, you know what time it is

[Bridge: Eazy-E + Dr. Dre]
(Eazy, hey Eazy!)
Wassup?
(Why do you wear your pants like that?)
I wear my pants like this for easy access, baby
Yeah, that's right
(Ey homeboy, where we taking this jam to?)
(COMPTON)
(Where?)
(COMPTON)
(Aw yeah)
Now I wanna know who ya came to see

(Eazy!)
Ayo, this record's almost over
(Eazy!)
...so that means y'all gotta get hyped up!
(Eazy!)
Come on, say it, say it, say it!
(Eazy!)
Do it, do it, do it, do it!
(Eazy!)
Everybody in the house!
(Eazy!)
Come on, say Eazy, come on!
(Eazy!)
Ayo, who y'all want?
(We want Eazy!)
Ayo Ren, let's kick another verse

[MC Ren & Dr. Dre]
Ren and Dre, the Villian and the Doctor together
Yo we can rock by ourselves, but we're together whenever
A funky track is included, it's getting better, not worse
Especially when Eazy's here to kick another verse

[Verse 3]
Aw, never, I'm just too clever
So, in fact, that no one can sever
A blow from a maniac and yo, I make it clear
So a register is all I hear
Money overturned, then I jet
To make another hit, for you to go and get
Record stores sold out because you love it
Another example of how Eazy duz it

[Bridge: Eazy-E + Dr.Dre]
(Eazy!)
Ha ha ha ha!
Who y'all want?
(We want Eazy!)
Aw yeah
(Eazy!)
All of me
Why not take all of me?
(We want Eazy!)
Who'd y'all come to see
(Eazy!)
Yeah
Yeah
(We want Eazy!)
Can I get down one time?
(Eazy!)
Yeah, you know what time it is
(We want Eazy!)
Yo stag, give me a funky solo homeboy

(Eazy!)
(We want Eazy!)
(Get funky with it)
(Eazy!)
(We want Eazy!)
(Get funky with it)
(Eazy!)
All of me
Why not take all of me?
(We want Eazy!)
(Get funky with it)
(Eazy!)
(We want Eazy!)
Turn this mother out!
(Eazy!)
(We want Eazy!)
(Get funky with it)
(Eazy!)
(We want Eazy!)
(Get funky with it)
(Eazy!)
All of me
Why not take all of me?
(We want Eazy!)
(Get funky with it)
(Eazy!)
(We want Eazy!)
Alright
Have a break right here
(Eazy!)
(We want Eazy!)
Check this out
(Eazy!)
*scatting*
(We want Eazy!)
(Eazy!)
Yo we just dropped a bomb on you
(We want Eazy!)
Check it out
(Eazy!)
(We want Eazy!)

[Verse 4]
Said it before, a miracle, a lyrical, and ever
Something that suckers can never sever
Sit for a second and check what jockeys are brazing
Pure dope, figure it out like amazing
Come to grips with the fact, Eazy-E ain't a lightweight
Nervous never, you could get broke with your brake
So if you're smart, take me from the start
The boyz 'n the hood are always hard
Time for a show, the stage I hit, and it's legit
'Cuz the crowd be like tripping and the girls be having a fit
It's like a riot, someone said I'm at the high
Everybody wants to scream and I try to get 'em quiet
To continue, never the less, they're on a mission to perditious
And to be in company with my permission
Exceptional, speaking of the E in Eazy-E
I gotta hear it, tell 'em who you came to see

(Eazy!)
(We want Eazy!)",westcoast
