index,name,duration_ms,popularity,num_markets,album,disc_number,is_explicit,track_number,release_date,artist,danceability,energy,key,loudness,mode,speechiness,acousticness,instrumentalness,liveness,valence,tempo,time_signature,lyrics,region
0,Still Talkin',227866,38,77,Eazy-Duz-It,1,True,1,1988-09-13,Eazy-E,0.724,0.804,7,-4.565,1,0.379,0.0846,0,0.674,0.781,90.051,4,"[Intro/Prelude]
Good evening, and welcome to Eazy's playhouse
You stupid muthafucka!
Now that you got the album
What the fuck are you gonna do with it, bitch?

[Ice Cube + Dr. Dre + Eazy-E]
I knew this nigga back in, uh, uh—back since a nigga was little
(You lying, you lying man)
The nigga come from Compton, Michigan, nigga
(Compton what? You ain't never met no Eazy-E)
Well, I'ma introduce him (You a damn liar!)
This is the craziest motherfucka you done seen (You a damn liar!)
This nigga's crazy—just listen!

[Verse 1]
Easily I approach
The microphone because I ain't no joke
Tell your momma to get off of my tip
I have no time to give her my dick
I'm gonna hold it, and walk around the stage and
If you fuck up I'm goin' to get my gauge and
Unload the barrel and laugh
'Cause I'm puttin' lead in your mothafuckin' ass
Psychopathic, but the hoes are attracted
Because when I'm on hard, my dick's at least a yard
In the days of old, I was a nut
Now I'll need at least 3 hoes when I fuck
'Cause I do a check—nut 1, nut 2
Then I save a nut for when there's nothin' else to do
Get used to the crew, bitch, 'cause I would never quit
As soon as you think that's it, I'm still talkin' shit

[Interlude: Ice Cube + Dr. Dre]
Ha ha, I told you that nigga was crazy
Eazy Eric, that's my boy, ha ha, godamnit
Go on, boy, wit' yo' bad self
Step up to the mic, nigga (Ay bitch, pass me my Ripple)

[Verse 2]
I got a fable that you need to listen to
It's a funky little rhyme about a bitch or a two
One's Sharon, the other one Shaun
I wanted to nut, but which one do I want?
Shaun said, ""Eazy, let me fuck you blind""
And Sharon said, ""E, I want to blow your mind""
I said fuck it, I know what should be done
Just pull your panties down and I'll fuck the biggest one
And then I get the other pussy, put it in the freezer
So I can always have a on-hold skeezer
Yeah, that's the ticket, I'll do it like that
So I told the hoes to take a big step back
Took the zipper down, eyes wide, and said
""Here's what I'm gonna put inside""
Grab it like a rabbit (grab it), let's work it (work it)
But I won't love you—when I'm done, I'll still be talkin' shit ...

[Interlude: Ice Cube + Dr. Dre + Eazy-E]
Ha ha, that boy good (Yeah, that boy's good)
(That muthafucka be talkin' all kinds of shit)
I used to get pussy like Eazy Eric every day
(You ain't no motherfucker) How you know, muthafucka?
(You're lyin', your dick can't get hard)
Oh, suck my dick, muthafucka (Nigga, you lyin')
Who you talkin' to? Well, get up then, nigga, shit...

[Interlude: Dr. Dre]
Wait a minute, wait a minute, cut this shit
Ayo Yella boy, why don't you rewind it

[Verse 3: Eazy-E ]
Niggas don't see I'm a 100 percent legit
And you know it ain't about all that bullshit
It's about fuckin' this bitch and that bitch
But not the bitch with the 7 day itch, like that ho'
Just throwin' me the pussy
She says she wants to do it like a doggy
She's bad, nobody is badder
But she got more crabs than a seafood platter
Bitch on the gank move, to skeaze me
Just to say ""I got fucked by Eazy""
So I slapped the ho' like a pimp
I might be a woman-beater but I'm not a pussy-eater
So when the shit hits the fan, it's outta my mouth
You don't like what I'm talkin' about?
All of y'all can just suck my dick
You could quote me now 'cause I'm still talkin' shit

[Interlude: Ice Cube + Dr. Dre]
The boy's good—I told you, boy
(Ay, I knew him when he was knee-high)
The nigga got talent—you don't know a damn thing
(I knew him when he was knee-high)
He still is knee-high, muthafucka
(Yeah, I like that part—bring that shit back one more time, Maestro)
That's that old Z.Z. Hill, huh? Ha ha ha
I tell ya, boy, I can do the Mashed Potato, nigga, what can you do?
(Muthafucka, I can do the boogaloo, I can do the boogaloo)
Boogaloo!? That old shit been played out back in 1967
(Man, fuck you; fuck you)",westcoast
1,Nobody Move,287413,43,77,Eazy-Duz-It,1,True,2,1988-09-13,Eazy-E,0.91,0.747,6,-4.814,0,0.254,0.0113,0,0.123,0.714,90.163,4,"[Intro]
Eazy-E: Yo Ren, you're ready to go get this money?
MC Ren: Believe that, boy
Eazy-E: You're strapped?
MC Ren: Yeah, you know it
Eazy-E: Let's go do this shit, man, I got it all planned out
MC Ren: Yeah, shoot any motherfucker that moves

[Sample]
Alright everybody

[Verse 1: Eazy-E]
This is a stick-up, everybody get face-down
Ren, gag their mouths so they can't make a sound
Tie em up for the fact that I'm kickin ass
I got my hand on my gat, and I'm tempted to blast
My name is Eazy, but I go the hard way out
This ain't personal, but now I'm about
To commit a crime and go through with it
You know what, no need for shaking, because I'm used to it
Take out the security guard with a slap of my hand
Yeah, he's wearing a badge, but he's a ol' ass man
Pop his ass in the head, and take his gun
So me and the punk can go one on one
Cover the lens on the TV screen
You know so me and my gang, just can't be seen
Lock the doors, and throw away the key
Close the blinds, so no motherfuckers could see
And smile, you know, cause I'm control of the shit
And no sucker ass nigga's gonna stop the hit
Wardrobes and locs, and a Ruthless shirt
That means I'm ready to work, and rush a fool to the dirt, so

[Hook]
Nobody move, nobody get hurt [gunshot]
Nobody move, nobody get hurt [gunshot]
Nobody move, nobody get hurt [gunshot]
Nobody move, nobody get hurt gunshot

[MC Ren]
Alright, anybody move and I'll blow your fucking head off

[Verse 2: Eazy-E]
Alright, empty your pockets, but do it slow
Take everything you got and lay it on the fucking floor
Don't make me have to set an example today
And blow one of you crazy motherfuckers away
I'm in a bank, and it's a little bit funny
Taking all you stupid motherfuckers' money
Peepin at a bitch cause my dick's on hard
Laughing at the dumb ass security guard
Who's tied up for the moment, not saying a word
I should have known it before, the motherfucker's a nerd
But back to the bitches I'm peepin'
And then untie the ho, so I can start creepin'
Took her to the backroom, about to jack
Cold trailed the bitch, with a gun in the back
I said: ""Lay down, and unbutton your bra!""
There was the biggest titties that a nigga ever saw
I said: ""Damn"", then the air got thinner
Only thought in my mind, was going up in her
The suspense was making me sick
She took her panties down and the bitch had a dick!
I said: ""Damn"", dropped the gat from my hand
(What I thought was a bitch, was nothing but a man)
Put the gat to his legs, all the way up his skirt
Because this is one faggot that I had to hurt, so

[Hook]

(I said get down. I want you all face-down on the floor
Anybody moves and I shoot)

[Verse 3: Eazy-E +  MC Ren ]
Stacking up the money and there's more to collect
Cause I don't give a fuck, I take traveller's cheques
Yo, Ren, peep out the window, and tell me what you see
Three motherfucking police staring at me; what to do now?
Hurry up and get armed
Alright, tell me, who hit the motherfucking alarm?
I'mma give ya a chance, and count to three
Or else five of y'all bitches are comin with me
(Alright, Alright, come on out niggas, or we're coming in
This is the only chance to turn yourself in)
Fuck you, we got hostages, and plenty of loot
And don't give a damn and not afraid to shoot
We're sending out the hostages, all except five
And if you don't meet our demands, they won't stay alive
We want a copter, so we can get away clean
And take some pussy along, if you know what I mean
One hostage got brave, and got off the floor
But I smoked his ass before he got to the door
(They shot a hostage, they shot a hostage)
You stupid motherfucker trying to run
Now you're dead as fuck trying to race a gun
(Alright, this is the last chance to get off your ass
Or else the tear gas is about to blast)
I ran to the back and Ren followed behind
To a hell of a spot that was hard to find
The bank was fucked up, the shit was smokin'
With screamin hostages, running and chokin'
Gettin away, but I was suddenly stopped
At point blank range, by a motherfucking cop
And I hope they don't think that a lesson was taught
Cause a nigga like the E was finally caught
My gat wouldn't fire, the shit wouldn't work
So, y'all know what time it is

[Hook]

[Outro]
([Police:] Well I'm giving you five seconds to let us through the gate or
I'm gonna shoot two of your guards)

(Hehe, they got me once, but they'll never get me again)",westcoast
2,Ruthless Villain,177426,37,77,Eazy-Duz-It,1,True,3,1988-09-13,Eazy-E,0.909,0.801,1,-4.079,1,0.286,0.0118,0,0.117,0.827,97.091,4,"[Intro]
MC Ren: Yo Dre, how much time we got left on ths tape?
Dr. Dre: About a couple of minutes
MC Ren: Well let me bust a freestyle then
Dr. Dre: Awright, go ahead

[MC Ren]
Ruthless gangsta, definition villain
Leave your shit unlocked and he's stealin'
So call tha police cause that's all you could do but
He'll get away without leavin' a clue

Dr. Dre: Wait a minute, wait a minute, cut this shit
Eh yo Yella boy why don't you rewind it
Hey, man you gotta get more hyped up than that
MC Ren: Damn, why don't you pump this shit up so it could fuck up my eardrums a little bit!
Dr. Dre: Allright bet

[Verse 1: MC Ren]
Ruthless gangsta, definition villain
Leave your shit unlocked and it's stealin'
So call tha police cause that's all you could do but
He'll get away without leavin' a clue
Keepin' shit in control like the neighborhood chief but
Referred to as a walking thief
They say he's a bad influence for the kids on the block
Why the fuck they blamin' him he's the one that they jock
Keepin' niggas in line, whoever fucks with his rhyme
And before you fuck with him you gotta fuck with his nine
Not scared to pull the trigger on a punk ass nigga
He could whoop his ass cause he's bigger
Size don't mean shit he's from the old school fool
He's a villain from the streets and he's supposed to rule
Not sayin' he's in shit but he's down for mine
He was put on the streets to keep niggas in line
Never givin' a fuck, cause you jealous of E
Because I know that he's a nigga that you want to be
He can't help it he's in shit but he don't hold shit back
He's a gangsta in black and he's about to attack

[Hook: Eazy-E]
Cause I'm a ruthless villain, cold tearin' shit up
Don't come on my face, pumpin' no kind of junk
Eazy-E's in control and if you press your luck
I'll smoke you like that and won't give a fuck

[Sample]
""Nickname Eazy-E...Ol' 8-Ball junkie!""

[Verse 2: MC Ren]
Ruthless gangsta, definition villain
You can lock up yo' shit, he's still stealin'
Gettin' respect cause the boy kicks butt
But the real meaning is he don't give a fuck
It's Eazy-E in the crowd but he's not in the 4
I tell his money flow as he collects from his ho'
All expenses paid for the rhymes that he made
Gold trophies in the house for the girls that he laid
Not a wimp he's a pimp, now of course he's the boss
So keep your bitch out his face or else she's gonna get tossed
Too hard to be fucked with, the boy got heart
Wanna fuck with him, he'll rip your head apart
Gangsta Gangsta, that's what they yellin'
But him with his gangsta stroll he keeps bailin'
Wherever he goes there's no discussion but silence
They say that he's the one promotin' gang violence
That's a lie just a critic all that whack bullshit
So let me tell you motherfuckers who you fuckin' with

[Hook: Eazy-E]
Cause I'm a ruthless villain, cold tearin' shit up
Don't come on my face, pumpin' no kind of junk
Eazy-E's in control and if you press your luck
I'll smoke you like that and won't give a fuck

Eazy-E: Yo Ren?
MC Ren: What's up?
Eazy-E: Let's get the fuck outta here!",westcoast
3,2 Hard Mutha's,264880,37,77,Eazy-Duz-It,1,True,4,1988-09-13,Eazy-E,0.858,0.934,6,-4.533,1,0.199,0.0862,0,0.107,0.831,114.856,4,"[Intro]
Eazy-E: Yo Dre, where's the goddamn drum machine?
Dr. Dre: Ah shit, I left the motherfucker with Pooh
Eazy-E: You dumb motherfucker what the fuck we gon' do now?
Dr. Dre: I don't know
Yella: Hey man I got some drums in the back
Dr. Dre: What the fuck is he talking bout
MC Ren: Do we look like we can play some fucking drums?
Yella: Man I can play the drums
Everyone: Bullshit!
Yella: Man I used to fuck it up at Compton High
Eazy-E: You motherfucking high
MC Ren: You fat guy
Yella:  Bullshit!
MC Ren: Give this nigga some sticks
*Drum roll*
MC Ren: Yo, fuck it up Yella

[Verse 1: MC Ren]
Yo we're two hard motherfuckers
Taking out any punk ass suckers
Can you believe this? if so be frightened
We're strong as fuck, with the power of a titan
Setting a mark of destruction get it
So don't front, and say you ain't with it
You wanna rumble with us you can't hang
Because we're something like a two man gang
Starting some shit is what we do best
Just care about ourself and say fuck the rest
So yo Eazy (wassup), bust it and shoot to kill
And tell these stupid motherfuckers the deal

[Verse 2: Eazy-E]
I look you dead in the eye then I spit (yeah)
I tell you to your face punk you ain't shit (you ain't shit)
I don't give a god damn about feelings
I'm just happy just as long as I'm killing
A 187's in progress, nigga
Just as soon as I pull this trigger
Automatic heavily, I start firing
And the kids on the block, I'm the one they're admiring
A bad mouth nigga on the violent tip
I catch you talking some shit and I'mma bust your lip
Now who you gonna tell that I'm making you soft
The police ain't shit cause I'm paying 'em off
I move slow, always ready to go so fuck it (so fuck it)
And bitches on my dick, they know that they can suck it
I'm a hardhead, always having a fit
When I'm not allowed to tear up shit
I'm a hard motherfucker (I'm hard motherfucker)

[Hook]
Two of the hardest motherfuckers
Two of the hardest motherfuckers
Two of the hardest motherfuckers

[Verse 3: MC Ren + Eazy-E]
Now look at me I'm a crazed bitch
With a gangster profanity pitch
Ren is a nigga that don't give a fuck
To a pussy ass fool trying to press his luck
I'm ready to scrap that's if you're ready to go
I'll take you out going toe to toe
E will start a conversion and hit you from the back
While you getting fucked by a ruthless jack
Critical condition is what you receive
Thinking of some back up to go and retrieve
But Eazy tell what would happen my man
They would get fucked up by a ruthless clan
So it's simple, we don't give a fuck, right?
So you and your boy can get the fuck out my sight
I'm on tilt with class getting ready to blast
Cause I'm a hard motherfucker

[Hook]
Two of the hardest motherfuckers
Two of the hardest motherfuckers
Two of the hardest motherfuckers
Two of the hardest motherfuckers

[Verse 4: Eazy-E + MC Ren]
Eazy and Ren is fucking it up again
Scheming up a plot before we begin
Because niggas like to stare like a bitch sometimes
They say how could them niggas have some hell of a rhymes
It's simple tell 'em what we mean
When the two baddest motherfuckers step on the scene
Now this is some shit -  Yo what are you saying
You stupid motherfuckers, they think I'm playing
Talking all kind of shit of shit but I'm cracking it up
I can afford to laugh cause I'm backing it up
I'm not a buster I'm more like a hitman
So if you don't wanna throw then you can get down
You don't like the fuck away from me
So you can stop the shit, trying to fuck the E

[Verse 5: MC Ren + Eazy-E]
You heard what he said and it's the truth so whats up
So if you want me to go well I'm about to nut up
The two baddest motherfuckers alive
So I don't think that you and your boys can survive
You gotta girl, well if she's good to go
I bet me and E already fucked the ho
A train was in effect and your bitch was rocked
By a hell of a nigga that was hard to stop
Yo Ren lets jet let's get the fuck on out
Because everybody knows what we're talking about
We're two hard motherfuckers

[Hook]
Two of the hardest motherfuckers
Two of the hardest motherfuckers
Two of the hardest motherfuckers
Two of the hardest motherfuckers
Two of the hardest motherfuckers

[Outro: MC Ren]
Like that like that
Break it down again, come on Yella break it down
Can I get a another role (one time)
It little simple for you
Break it down to break shine
Let me get a funky role right here
Aight on the 3, on the 2
Ah yeah here we go y'all, break it down on the 1
Here we go, let me get a funky role right here
Two times, two time, two time..",westcoast
4,Boyz-N-The-Hood - Remix,379733,58,77,Eazy-Duz-It,1,True,5,1988-09-13,Eazy-E,0.837,0.692,7,-4.251,1,0.337,0.0383,0,0.212,0.805,87.775,4,"[Intro]
Dr. Dre: Hey, yo, remember that shit Eazy did a while back?
Motherfuckers said it wasn't gonna work.
Ice Cube: That crazy shit?
Dr. Dre:  Yeah, the stupid shit, man.
MC Ren:  That shit was dope.
Dr. Dre:  Hey yo, Eazy!
Eazy-E: Wassup?
Dr. Dre: Hey man, why don't you come off the piano for a minute and bust this crazy shit?

[Verse 1]
Woke up quick at about noon
Just thought that I had to be in Compton soon
I gotta get drunk before the day begins
Before my mother starts bitchin' about my friends
About to go and damn near went blind
Young niggas at the pad, throwin' up gang signs
Ran in the house and grabbed my clip
With the MAC-10 on the side of my hip
Bailed outside and pointed my weapon
Just as I thought, the fools kept steppin'
Jumped in the fo', hit the juice on my ride
I got front and back and side to side
Then I let the Alpine play
Bumpin' new shit by N.W.A
It was ""Gangsta Gangsta"" at the top of the list
Then I played my old shit, it went somethin' like this
Cruisin' down the street in my six-fo'
Jockin' the bitches, slappin' the hoes
Went to the park to get the scoop
Knuckleheads out there, cold-shootin' some hoops
A car pulls up, who can it be?
A fresh El Camino rollin', Kilo G
He rolled down his window and he started to say
It's all about makin' that GTA

[Hook]
'Cause the boyz n tha hood are always hard
You come talkin' that trash, we'll pull your card
Knowin' nothin' in life but to be legit
Don't quote me, boy, 'cause I ain't said shit

Yo, man!
Get the fuck out!
Pump that beat!
Mothafucka, say what?

[Verse 2]
Donald B's in the place to give me the pace
He said my man J.D. is on freebase
The boy J.D. was a friend of mine
'Til I caught him in my car, tryin' to steal my Alpine
Chase him up the street to call a truce
The silly motherfucker pulls out a deuce-deuce
Little did he know I had a loaded 12-gauge
One sucker dead, LA Times front page

[Hook]
'Cause the boyz n tha hood are always hard
You come talkin' that trash, we'll pull your card
Knowin' nothin' in life but to be legit
Don't quote me, boy, 'cause I ain't said shit

Yo, Leroy!
Beer drinkin', breath stinkin', sniffin' glue

[Verse 3]
Bored as hell and I wanna get ill
So I went to a spot where my homeboys chill
The fellas out there makin' that dollar
I pulled up in my 6-4 Impala
They greet me with a 40 and I start drinkin'
And from the 8-ball my breath starts stinkin'
Left to get my girl, to rock that body
Before I left I hit the Bacardi
Went to her house to get her out of the pad
Dumb ho said somethin' that made me mad
She said somethin' that I couldn't believe
So I grabbed the stupid bitch by her nappy-ass weave
She started talkin' shit, wouldn't you know?
Reached back like a pimp, slapped the ho
Her father jumped up and he started to shout
So I threw a right cross and knocked his old ass out

[Hook]
'Cause the boyz n tha hood are always hard
You come talkin' that trash, we'll pull your card
Knowin nothin' in life but to be legit
Don't quote me, boy, 'cause I ain't said shit

Who do you think you are, Mr. Big Stuff?
Rock mothafucka, like the hard three the hard way

[Verse 4]
I'm rollin' hard, now I'm under control
Then wrapped the six-fo' round a telephone pole
I looked at my car and I said, ""Oh, brother
I'll throw it in the gutter and go buy another.""
Walkin' home and I see the G ride
Now Cat is drivin' Kilo on the side
As they busted a U, they got pulled over
An undercover cop in a dark green Nova
Cat got beaten for resistin' arrest
He socked the pig in the head for rippin' his Guess
Now G is caught for doin' the crime
Fourth offense on the boy, he'll do some time

[Hook]
'Cause the boyz n tha hood are always hard
You come talkin' that trash, we'll pull your card
Knowin' nothin' in life but to be legit
Don't quote me, boy, 'cause I ain't said shit

L.A. playa
Big Drum beater

[Verse 5]
I went to get them out, but there was no bail
The fellas caused a riot in the county jail
Two days later in municipal court
Kilo G on trial cold cut a fart
""Disruption of the court,"" said the judge
On a six-year sentence, my man didn't budge
Bailiff came over to turn him in
Kilo G looked up and gave a grin
He yelled out ""Fire!"", then came Suzy
The bitch came in with a sub-machine Uzi
Police shot the bitch but didn't hurt her
Both upstate for attempted murder

[Hook]
'Cause the boyz n tha hood are always hard
You come talkin' that trash, we'll pull your card
Knowin' nothin' in life but to be legit
Don't quote me, boy, 'cause I ain't said shit

Yeah, I kicked a little ass
But that was a blast from the past, mothafucka
Get busy, y'all y'all y'all y'all!",westcoast
5,Eazy-Duz-It,259493,57,77,Eazy-Duz-It,1,True,6,1988-09-13,Eazy-E,0.827,0.728,2,-3.912,1,0.307,0.0768,0,0.237,0.692,90.872,4,"[Intro: Michel'le +  Eazy-E]
He was once a thug from around the way
Eazy, but you should
Bitch shut the fuck up, get the fuck out of here
Yo, Dre (What's up?) give me a funky ass bassline

[Bridge]
What the fuck is up?
In the place to be
Coming on the mic is Eazy-mothafuckin-E
Dre is on the beat, Yella's on the cut
So listen up close while we rip shit up

[Verse 1]
Well I'm Eazy-E, I got bitches galore
You may have a lot of bitches but I got much more
Wit my super duper group coming out the chute
Eazy-E, motherfuckers, cold knocking the boots
'Cause I'm a hip-hop thugster - I used to be a mugster
If you heard (Dopeman), you think I own a drugstore
Getting stupid because I know how
And if a sucker talks shit, I give him a (POW)
8 ball sipping, the bitches are flipping
Slow down, I hit a dip and, continue my tripping
Hitting my switches, collect from my bitches
The money that I make so I can add to my riches
Fill my stash box and start rubbing my gat
Feeling good as hell because my pockets are fat
A hardcore villian cold roaming the streets
And wit a homie like Dre just supplying the beats

[Hook]
Because I'm a gangsta having fun
Never leave the pad without packing a gun
Hitting hard as fuck, I make you ask what was it
Boy, you should have known by now, Eazy-Duz-It

[Bridge]
(""I was"") (""knocking muthafuckas out"")
(""What's your name, boy?"")
(""Funky, fresh Eazy-E"")
(""Kick, kick that shit"")
(""Where you from fool?"") (""Compton"") (""Yeah!"")

[Verse 2]
Rolling through the hood, cold tearing shit up
Stick my head out the window and I say what's up
To the niggas on the corner cold bumping the box
But you know that's an alibi for slanging the rocks
A dice game started so I said what the fuck
So I put my shit in park and had to try my luck
Hard to roll wit my bitch jocking 24-7
Rolled them muthafuckas, ate 'em up, hit 11
Got another point, I made a ten a fo'
Was taking niggas money and was itching for mo'
Laughing in their faces and said you're all making me rich
Till one punk got jealous, cold slap my bitch
He pulled out his gat, I knew he wouldn't last
So I said to myself, homeboy, you better think fast
He shot (gunshots), Then I shot (gunshots)
As you can see, I cold smoked his ass (ha ha)

[Hook]
Because I'm a gangsta having fun
Never leave the pad without packing a gun
Hitting hard as fuck, I make you ask what was it
Boy you should have known by now, Eazy-Duz-It

[Interlude: Dr. Dre + Eazy-E (MC Ren)]
Wait a minute, wait a minute, who does it
Muthafuckin' Eazy does it
(But how does he do it)
""Eazy duz it, do it eazy, that's what I'm doing""
(""Stop!"") (Man, whatcha gonna do now?)

[Verse 3]
Now I'ma break it down just to tell a little story
Straight out the box from the gangsta category
About a sucker, a sucker muthafucka
He's addicted, he's a smoker but in Compton called a clucker
He used to have a house car and golden rings
But the cooky cooky crack took all those things
He must of been starving 'cause he broke in my house
Caught the nigga on the street and straight took his ass out
Now I'm wanted for a murder that I had to commit
Yeah I went to jail but that wasn't shit
Got to the station about a quarter of nine
Call my bitch to get me out 'cause I was down for mine
The bitch was a trip cold hung up the phone
Now my only phone call was in the ganking zone
All the SHIT I did for her like keeping her rich
I swear when I get out, I'm gonna kill the bitch
Well by now you should know it was just my luck
The bailiff of the station was a neighborhood cluck
I looked him straight in the eye and said what's up
And said let's make a deal, you know I'll do you up
Now back on the streets and my records are clean
I creeped on my bitch wit my Uzi machine
Went to the house and kicked down the do'
Unloaded like hell, cold smoked the ho

[Hook]
Because I'm a gangsta having fun
Never leave the pad without packing a gun
Hitting hard as fuck, I make you ask what was it
Boy, you should have known by now, Eazy-Duz-It

[Outro]
From around the way, born in '73
Harcore B-boy named Eazy-E
It's '88 now, '73's obsolete
A nigga with a serious ass attitude and a hundred percent street
And if you all wanna hear some more...
In one way or the other, I'm a bad brother
Word to the muthafucka",westcoast
