index,name,duration_ms,popularity,num_markets,album,disc_number,is_explicit,track_number,release_date,artist,danceability,energy,key,loudness,mode,speechiness,acousticness,instrumentalness,liveness,valence,tempo,time_signature,lyrics,region
7,Ghetto Gospel,280493,26,78,R.A.P. Music,1,True,8,2012-05-15,Killer Mike,0.451,0.753,6,-10.192,1,0.126,0.137,2e-05,0.45,0.429,165.997,4,"And I'm sitting on the edge of my bed holding my head
Trying to make this cake like a baker
And get some bread
My mama said hustlin' does come with feds
Time do the crime you better had be prepared
For what comes with it the killing the court convictions
Snorting, bitches, the snitches often they get acquitted
While the real sent to prison, to rot away while they living
And all because I say dope shit they on a mission
To nail my black ass to the wall with a conviction
I pray the Lawd hear me but really Lawd is ya listen'n
Praying when I'm in trouble I'm speaking with forked tongue
I say I'm out the game but I'm flinching like George Jung
I must be in the clutches of Satan it's all warm
My mama took you to the ""root lady"" to read my palm
She puts beads on my neck saying they protecting me from harm
But fuck this old witch, I went and got a gun

[Hook:]
Oh Lord, Jesus, glory
Oh Lord
Oh Lord, Jesus, glory
Oh Lord

Looking at the bezel of my Breitling
Thinking that I used to sell raps for enlightenment
But I got lapped by them guys selling lies for the white man
Now I sell pies for the white man
And my tour bus is a moving indictment
This must be how Huey felt when the revolution failed
And in Oakland nigga turned him on to a sack of yayo
You know this feeling false but it feels like yeah
I may have lost my cause but not a reason to rebel
Revolutionary or drug dealer I'm in jail
And the C.O.'s call me nigga either way when I'm there
Just like they did Pac
Just like they do Mumia
Just like they doing to Mutulu or Assata if they see her
And ain't no justice if it's just us in court
For my folk and my people free Hoover, free Fort
The Lord never break us if we all on one accord
You know it

[Hook:]
Oh Lord, Jesus, glory
Oh Lord
Oh Lord, Jesus, glory
Oh Lord

Even as I'm standing here iceless Mike is priceless
Women with me prettier than Isis
Don't know if she black or a white chick
But I know this pussy and excitement
Gonna lead to indictments
The women and the fame put shade on enlightenment
I don seen dark days come to many bright men
I done seen a damn dime fine
As a fine wine take an Einstein mind
Leave 'em deaf dumb blind
Fuckin with them jezebel whores
Liars of Delilah even marrying a Pandora
Pretty parasite she will use ya, this ain't what you used to
Stone cold bitch she Medusa
Dope ass pussy might make you an abuser
You an addict not in love, boy
Don't get it confused, bruh
She don't need a boyfriend she just need a booster
She the devil's pie guy
You was fucking Lucifer

[Hook:]
Oh Lord, Jesus, glory
Oh Lord
Oh Lord, Jesus, glory
Oh Lord",south
8,Butane (Champion's Anthem) [feat. El-P],198026,36,78,R.A.P. Music,1,True,9,2012-05-15,Killer Mike,0.703,0.782,4,-6.686,0,0.3,0.00859,0.0,0.692,0.185,83.046,4,"[Verse 1: Killer Mike]
(Yeah, Yeah, Yeah, Yeah)
Looking for the truth, yeah it's me
Everything Polo to the floor though, even at the grocery store though
Picture perfect, take a photo, and take the pic you biting bitch
And go and stitch a logo (Yeah, Yeah, Yeah, Yeah)
Hit you with the quatro, but my girl Mercedes
With the Audi say that Quatro was a two door so a typo
You can put on Killer Kill, Fat Boy, or just Michael
Call me what you want but still never call me rival
They will call you dead and I will call you gone
The Lord, sweet Jesus, will be weeping calling your ass home
If underground rap royalty is what I’m meant to be
Then I will be the shit and you ain't shit to me

[Hook]
We the ones, we the winners, we the champions
Champagne at the end of our campaign
Spit fire, naked truth like the blue flame
Like the blue flame (Yeah, Yeah, Yeah, Yeah)
Let me see your hands up if you do the same
Caught the plug and we bolt like Usain
More money, more power, more butane
Burn the motherfucker down, down

[Verse 2: Killer Mike]
Life's a bitch so I mack on her immaculate
I don't wear no monkey watches, Rolex is too accurate
My rhymes are actually accurate, meaning I don't fiction in my diction
To the masses, this perfection is performed through many practices
Like prostitutes on mattresses, this shit just come naturally
Easy as Osama’s bombers takin many casualties
Like Columbine I’m down for mine I’m here to kill the faculty
Killin them or killin me, this is my soliloquy
Iller than the illest beat, I will spit the illest shit
From right here to infinity, Till I reach the dirt
I will search the earth endlessly looking for the illest, see
Ain’t nobody lyrically as ill as me, 'less Eazy-E
Come back from A.I.D…S yes
Get a beat from E-L-P, ghostwritten from my partner T.I.P
Cube and me and we time travel back to 95
Jumping in a 63 Impala playing Cuban Linx

[Hook]
Yo Mike they fucked up putting us together man

[Verse 3: EL-P]
Yo, I'm a Grinch with a grin, I will shit on your kids
Get a life, get a grip, get a hold on my dick, bitch, make a wish
I'm a knife, I'm nothing-that's-nicer-than-getting-sliced-up
The switch, the machete, the feti Yeti, the shyster
Icer, getting-closer-to-Christ ya
Might just find that the design of your life is an angel hair short of divine love
I stink, I just stuck up a truck that said Brinks
I'm a Sphinx, snorted so much that my nose just broke off, think
I’m alone again, clutching a loaded Glock soaked in chromium
Hoping that the thought police just don't bust in my home again
Life is tough, you'll get snuffed in the buff
So dystopian, ruff ruff, hear the call of the copper mutts on the hunt
What the fuck, this is not what my mother said I'll become
Star-spangler wranglers got my hopes on the run
Getting closer now, maybe our society's supposed to drown
Middle fingers up on the Titanic as it's going down

[Hook]",south
9,Anywhere But Here (feat. Emily Panic),211240,28,78,R.A.P. Music,1,True,10,2012-05-15,Killer Mike,0.547,0.677,6,-9.612,1,0.0823,0.00328,0.469,0.159,0.324,84.987,4,"[Intro]
I gotta get out of here, this city’s gonna kill me
Could be anywhere
Anywhere but here
I wonder how long before this shit gone take me under

[Verse 1]
Moving through New York City in a black seven fifty
Like Batman movin through Gotham
Dodging pot holes as I gently move through Harlem with my wheels on slalom
Pain in my eyes as I'm passing the place
Where they found Sean Bell and they shot him (Queens)
Forty one times, he committed no crime
But I guess life ain't Times Square
But in the city that’s gritty where the bottom lives shitty
And the mayor’s a billionaire
You learn Manhattan keep on making it
And Brooklyn, keep on taking it
Cause life just ain't that fair
For the kids in the park, watching out for the Narcs
Blowing Sour Diesel in the air
Tryin' to flip them a pack, stack up a couple racks
And make it the hell outta here… (New York)

[Hook]
Let the city peel away right from under you
There are too many ghosts in this town
I can hear them calling out to me, out to me, out to me
I can hear them calling out

[Bridge]
Let the city peel away
There were too many ghosts in this town
I can hear them calling out to me, out to me!

[Verse 2]
I maneuver through the ATL in a black SL
With the goddess of a black female
This is black male Heaven with the ballers are professing
But to me home feels like Hell
Even though it’s black top from the mayor to the cops
Black blood still gets spilled
They raided a house, no drugs were ever found
But a black grandmother laid killed
Like the dream of the King when the sniper took his life
On the balcony of Lorraine Motel
From now forthward, these young black boys
Seem to self-sabotage they selves
Or maybe they're just smart, and they choose to go hard
Cause they know the good guy will fail
So you ask what happens to a dream deferred
Langston, well it kills itself... (Atlanta)

[Hook]
Let the city peel away right from under you
There are too many clouds in the sky
I can hear them calling out to me
I can hear them calling out
Anywhere but here",south
10,Willie Burke Sherwood,263520,27,78,R.A.P. Music,1,True,11,2012-05-15,Killer Mike,0.651,0.946,6,-6.765,1,0.0905,0.0099,0.0,0.442,0.126,120.026,4,"[Intro]
No matter how good a woman is, she still can't really teach him to be no man or daddy

[Verse 1]
Used to walk around with a head full of naps
Chubby young kid with a head full of raps
Doing what he can, just trying to adapt
Jumped to the block off of grandma's lap
Jumped to the block, so did every emcee
But gotta tell the truth, yeah, the block wasn't me
Lookin' for adventure, but the block was not
The block was real, Woo got killed
Half a year later, Big Spank got killed
And I got robbed, and Ronnie got shot
And I bought my first tape by 2Pac
And I got hard, cause I was smart
I knew that the weak and the meek couldn't make it in the street
Had to assert yourself to survive
So I convinced myself it was better for me
To be Jack in The Lord of the Flies
It's a book I read, books I read
Cause I'm addicted to literature
As a young boy rollin' 'round with the clique
Cause of that I was insecure
I was insecure cause I realized
Ain't no room for the civilized
When the wild men rumble in the jungle
And that's why Simon and Piggy died
Ralph survives, but he lives changed
Nothin's the same, shit'll drive a man out his brain
Drive a young man insane
My cousin Jimmy had a breakdown he ain't never been the same
And he never will be again
If I could fix his brain
Take back the crack in his mind
Give it all back, you can have the racks and fame
I'd give it all back in exchange

[Hook]
This is for the dads and the grandads
And the little homies that ain't never had dads
This is for the uncles and the OGs
And the lil homies, and the YGs
This is for the men I look up to
And all the struggles that the men had to go through
For every man that's ever had to man up
If that's you, let me see you put your hands up

[Verse 2]
I lost my youth, chasin' my youth
Made me a youth in the back of a coupe
Teenage love, like Slick Rick said
I hit her with my Dougie and I had a gold tooth
Fur Kangol, Filas too
She was light-skinned red gold tooth
But of course it didn't last cause I had to go to college
And she was still in high school
Damn, I'm a dad, this is bad
This ain't good, my baby's in the hood
And I'm walkin' 'round the black ivy league campus
Like I wish you house niggas would
So I go get a job, UPS
Where they treat you like BS and
You all know how the story goes
Drop out of college and sell 'ses
I figured I'd invest in studio time
Drop rhymes, have success
But, mostly I got fronted on, stunted on
Nigga dealt with some stress
I'll take that two, take that three
Cause my momma got to see me on TV
And my grandmomma got to get her Grammy
And my grandaddy got to see his boy eat
See his boy grow, I wish I never had that show
I wish you never had to go
Wish you could meet my wife, wish you could see my life
But you had to see the light
Wish I had you one more day
Wish I had tomorrow that's your birthday
We can sip gin, straight get fade
We can ride old schools through the trey

[Hook]",south
11,R.A.P. Music,266200,31,78,R.A.P. Music,1,True,12,2012-05-15,Killer Mike,0.674,0.835,8,-6.237,1,0.125,0.0145,0.0,0.146,0.319,74.995,4,"[Intro]
I've never really had a religious experience, in a religious place. Closest I've ever come to seeing or feeling God is listening to rap music. Rap music is my religion. Amen

[Verse 1]
What I say might save a life, what I speak might save the street
I ain't got no instruments, but I got my hands and feet
Hands gonna clap and feet gonna tap, El-P beats to make that snap
And I ride 'em with my raps and they all tight as my naps
And my naps is all I got and this beautiful ebony skin
And the music in my heart and the words put in the wind
And the words put in the wind comin' back like a boomerang
When I take this microphone, point it at the crowd, they start to sing

[Hook x2]
This is jazz, this is funk, this is soul, this is gospel
This is sanctified sick; this is player Pentecostal
This is church; front pew, amen, pulpit
What my people needin'? The opposite of bullshit
This is jazz, this is funk, this is soul, this is gospel
This is sanctified sick; this is player Pentecostal
This is church; front pew, amen, pulpit
What my people needin'? The opposite of bullshit

[Verse 2]
It's that Robert Johnson, that Muddy Waters
That James Brown, Augusta, Georgia
That Ray Charles, that Stevie Wonder
That Mayfield, that Superfly
That Willie Hutch and that Mack
It's that blues man, that soul man
That OutKast, that Southernplayalisticadillac
It's that Jimi Hendrix, that George Clinton
I feel it in my bones
Aretha Franklin, that Shirley Caesar
Miss Nina Simone
That Sade, that Love is King
That Coltrane, that Love Supreme
That Miles Davis, Bitches Brew
That ""beeeyotch"" said by Playboy Too

[Hook x2]

[Verse 3]
I got things to do, before I meet that glory in the sky
And my baby girl b-day six months away, she gonna be five
So I pray to the Lord he spare me, and I make it by and by
And I help souls stay out of Hell with what I testify
And maybe when I grab that microphone and never lie
That'll merit that he spare me, I won't have to feel that fire
So Killa Kill gonna spit that real on each and every song
And each and every poem, until the good lord call me home, gone!

[Hook]",south
